,tea_name,tea_origin,tea_star,tea_price,tea_availability,tea_link
113,Kaneroku Matsumoto Tea Garden: Shincha - Limited Edition - Premium 特上新茶2021,Kaneroku Matsumoto Tea Garden, 1 ,From JPY ¥700,Only 3 units left,https://yunomi.life//collections/green-tea/products/kaneroku-matsumoto-tea-garden-shincha-limited-edition-premium
114,"Yancha: Spring Harvest Light Roast Yabukita Hojicha from Aruse Village, Tokushima",Yancha, 0 ,From JPY ¥499,"In stock, 19 units",https://yunomi.life//collections/green-tea/products/yancha-spring-harvest-light-roast-yabukita-hojicha-from-aruse-village-tokushima
115,"Nabeshima Meicha #01: Premium Spring Sencha from Chiran, Kagoshima 知覧  鹿児島",Nabeshima Meicha, 0 ,"From JPY ¥1,200",Available,https://yunomi.life//collections/green-tea/products/nabeshima-meicha-01-premium-spring-sencha-from-chiran-kagoshima
116,"Nabeshima Meicha #02: Premium Spring Sencha from Mino Village, Gifu 美濃茶  岐阜県",Nabeshima Meicha, 0 ,From JPY ¥800,Available,https://yunomi.life//collections/green-tea/products/nabeshima-meicha-02-premium-spring-sencha-from-mino-village-gifu
117,"Nabeshima Meicha #03: Premium Spring Sencha from Ise, Mie 伊勢茶  三重県",Nabeshima Meicha, 0 ,"From JPY ¥1,000",Available,https://yunomi.life//collections/green-tea/products/nabeshima-meicha-03-premium-spring-sencha-from-ise-mie
118,"Nabeshima Meicha #04: Premium Spring Sencha from Ureshino, Saga 嬉野茶  佐賀県",Nabeshima Meicha, 0 ,"From JPY ¥1,000",Available,https://yunomi.life//collections/green-tea/products/nabeshima-meicha-04-premium-spring-sencha-from-ureshino-saga
119,Hiraoka Tea Garden: Shincha - Imperial Grade Sencha 【新茶】極上煎茶,Hiraoka Tea Garden, 0 ,"From JPY ¥1,200",Available,https://yunomi.life//collections/green-tea/products/hiraoka-tea-garden-shincha-imperial-grade-sencha
120,"Murata Tea Garden: Light Roasted Fukamushi Hojicha Green Tea From Kikugawa, Shizuoka 浅炒りほうじ",Murata Tea Garden, 0 ,From JPY ¥480,"In stock, 22 units",https://yunomi.life//collections/green-tea/products/murata-tea-garden-light-roasted-fukamushi-hojicha-green-tea-from-kikugawa-shizuoka
121,"Hiraoka Tea Garden: Shincha - Premium Grade Sencha ""Sakura"" 【新茶】特上煎茶「桜」",Hiraoka Tea Garden, 0 ,"From JPY ¥1,000",Available,https://yunomi.life//collections/green-tea/products/hiraoka-tea-garden-shincha-premium-grade-sencha-sakura
122,"Hiraoka Tea Garden: Shincha - Premium Grade Sencha ""Murasaki"" (Single Cultivar Yabukita)【新茶】高級煎茶「紫」",Hiraoka Tea Garden, 0 ,From JPY ¥800,Available,https://yunomi.life//collections/green-tea/products/hiraoka-tea-garden-shincha-premium-grade-sencha-murasaki-single-cultivar-yabukita
123,"Hiraoka Tea Garden: Spring Premium Grade Sencha ""Momo"" 【新茶】高級煎茶「桃」",Hiraoka Tea Garden, 0 ,From JPY ¥700,Available,https://yunomi.life//collections/green-tea/products/hiraoka-tea-garden-shincha-premium-grade-sencha-momo
124,"Hiraoka Tea Garden: Shincha - Premium Grade Sencha ""Midori"" 【新茶】高級煎茶「緑」",Hiraoka Tea Garden, 0 ,From JPY ¥600,Available,https://yunomi.life//collections/green-tea/products/hiraoka-tea-garden-shincha-premium-grade-sencha-midori
125,Hiraoka Tea Garden: Shincha - Superior Grade Sencha 【新茶】上煎茶,Hiraoka Tea Garden, 1 ,From JPY ¥500,Available,https://yunomi.life//collections/green-tea/products/hiraoka-tea-garden-shincha-superior-grade-sencha
126,Hiraoka Tea Garden: Shincha - Superior Grade Kukicha Leaf Stem Tea 【新茶】上くき茶,Hiraoka Tea Garden, 0 ,From JPY ¥500,Available,https://yunomi.life//collections/green-tea/products/hiraoka-tea-garden-shincha-superior-grade-kukicha-leaf-stem-tea
127,"Marushige Shimizu Tea Farm: Kabusecha Shaded Green Tea, Tsuyuhikari つゆひかり",Marushige Shimizu Tea Farm, 0 ,JPY ¥480,Available,https://yunomi.life//collections/green-tea/products/marushige-shimizu-tea-farm-kabusecha-shaded-green-tea-tsuyuhikari
128,Azuma Tea Garden: Kyobancha Smoky Roasted Green Tea 京番茶,Azuma Tea Garden, 0 ,From JPY ¥480,"In stock, 4 units",https://yunomi.life//collections/green-tea/products/azuma-tea-garden-kyobancha-smoky-roast
129,"Nakai Tea Farm: Uji Matcha Seisho (Samidori) Standard Ceremonial Grade 30g, Wazuka, Kyoto",Nakai Tea Farm, 1 ,"JPY ¥1,799",Only 1 unit left,https://yunomi.life//collections/green-tea/products/nakai-tea-farm-uji-matcha-seisho-samidori-standard-ceremonial-grade-30g-wazuka-kyoto
130,Yunomi Matcha Naturally Grown - Standard Ceremonial Grade,Yunomi Tea, 0 ,"From JPY ¥1,699",Available,https://yunomi.life//collections/green-tea/products/yunomi-matcha-naturally-grown-standard-ceremonial-grade
131,"Nakai Tea Farm: Uji Matcha Seisho Blended Standard Ceremonial Grade 100g/1kg, Wazuka, Kyoto",Nakai Tea Farm, 1 ,"From JPY ¥2,999",Available,https://yunomi.life//collections/green-tea/products/nakai-tea-farm-uji-matcha-seisho-blended-standard-ceremonial-grade-100g-wazuka-kyoto
132,Kurihara Tea #23: Camp Style Tea - Powdered Sencha Hime Shizuku (0.8g x 20 single serving sticks),Kurihara Tea Farm, 0 ,"From JPY ¥1,999",Available,https://yunomi.life//collections/green-tea/products/kurihara-tea-23-camp-style-tea-powdered-sencha-hime-shizuku-single-serving-sticks
133,Zenkouen Tea Garden: #15 Genmai hojicha by Zenkouen Tea Garden (Grown Pesticide Free) 無肥料自然栽培ほうじ玄米茶,Zenkouen Tea Garden, 3 ,From JPY ¥500,Available,https://yunomi.life//collections/green-tea/products/zenkouen-tea-garden-15-genmai-hojicha-by-zenkouen-tea-garden-grown-pesticide-free
134,"Yancha: Premium Yabukita Sencha (2.5g Tea Bags) from Aruse Village, Tokushima",Yancha, 0 ,From JPY ¥599,"In stock, 15 units",https://yunomi.life//collections/green-tea/products/yancha-premium-yabukita-sencha-tea-bags-from-aruse-village-tokushima
135,"Yancha: Premium Yabukita Sencha Green Tea Powder from Aruse Village, Tokushima",Yancha, 0 ,"JPY ¥1,999","In stock, 4 units",https://yunomi.life//collections/green-tea/products/yancha-premium-yabukita-sencha-green-tea-powder-from-aruse-village-tokushima
136,"KU007 Tomizawa Tea Garden: Gyokuro Tamaryokucha from Mashiki, Kumamoto - ""Green Tea.Lab"" 玉露",Tomizawa Tea Garden, 0 ,From JPY ¥700,Available,https://yunomi.life//collections/green-tea/products/ku007-tomizawa-tea-garden-gyokuro-tamaryokucha
137,Kurihara Tea #20: Camp Style Tea - Powdered Gyokuro (40g bag),Kurihara Tea Farm, 0 ,"From JPY ¥1,999",Available,https://yunomi.life//collections/green-tea/products/kurihara-tea-20-camp-style-tea-powdered-gyokuro
138,Ayumi Farms (Cyittorattu): Sencha that Laughs with the Mountains 山と笑う煎茶 80g,Ayumi Farms, 1 ,"JPY ¥1,499",Available,https://yunomi.life//collections/green-tea/products/ayumi-farms-cyittorattu-sencha-that-laughs-with-the-mountains
139,Kurihara Tea #21: Camp Style Tea - Powdered Gyokuro (0.8g x 20 single serving sticks),Kurihara Tea Farm, 0 ,"From JPY ¥1,999",Available,https://yunomi.life//collections/green-tea/products/kurihara-tea-21-camp-style-tea-powdered-gyokuro-0-8g-x-20-single-serving-sticks
140,Ayumi Farms (Cyittorattu): Setoya's Megumi-cha - Hojicha Roasted Green Tea (100g),Ayumi Farms, 0 ,"JPY ¥1,199",Available,https://yunomi.life//collections/green-tea/products/ayumi-farms-cyittorattu-setoyas-megumi-cha-hojicha-100g
141,"Yancha: Premium Yabukita Sencha from Aruse Village, Tokushima",Yancha, 0 ,JPY ¥399,"In stock, 12 units",https://yunomi.life//collections/green-tea/products/yancha-premium-yabukita-sencha-from-aruse-village-tokushima
142,"Nishide: National Tea Competition, Gold Medal, Minister's Award Winning Kabusecha (Katsutani Kenji, 2018 aged) 全国茶品評会農林水産大臣賞受賞茶勝谷健士作手摘みかぶせ茶",Nishide Tea Factory, 0 ,"JPY ¥4,999",Only 2 units left,https://yunomi.life//collections/green-tea/products/nishide-national-tea-competition-gold-medal-ministers-award-winning-kabusecha-katsutani-kenji
143,"Chiyonoen Tea Garden: #26 5-tea boxed gift set - gyokuro, sencha, black tea, genmaicha with matcha, hojicha 【よくばりのお茶】5本　雪ふる山のギフトセット",Chiyonoen Tea Garden, 1 ,"JPY ¥9,500",Only 1 unit left,https://yunomi.life//collections/green-tea/products/chiyonoen-tea-garden-5-tea-sampler-set-gyokuro-sencha-black-tea-genmaicha-with-matcha-hojicha
144,"Kanes Tea: 2020 National Tea Competition Gold Medal Award Winning Asamushi Sencha from Kawane, Shizuoka",Kanes Tea Factory, 1 ,"JPY ¥4,999","In stock, 19 units",https://yunomi.life//collections/green-tea/products/2020-national-tea-competition-gold-medal-award-winning-asamushi-sencha-from-kawane-shizuoka
145,"Nagatani Tea: Gyokuro Gokou, Single Cultivar from Ujitawara, Kyoto (Naturally Grown)",Nagatani Tea, 0 ,From JPY ¥999,Available,https://yunomi.life//collections/green-tea/products/nagatani-tea-gyokuro-gokou-single-cultivar-from-ujitawara-kyoto
146,"Nagatani Tea: Gyokuro Uji Hikari, Single Cultivar from Ujitawara, Kyoto",Nagatani Tea, 0 ,"From JPY ¥1,099",Available,https://yunomi.life//collections/green-tea/products/nagatani-tea-gyokuro-uji-hikari-single-cultivar-from-ujitawara-kyoto
147,Ayumi Farms (Cyittorattu): Kukicha - Spring Leaf Stem Green Tea,Ayumi Farms, 0 ,JPY ¥639,Available,https://yunomi.life//collections/green-tea/products/ayumi-farms-kukicha
148,"Kajihara Tea Garden: #01 Densho Premium, Kamairicha Green Tea from Kumamoto 伝承プレミアム 釜炒り茶",Kajihara Tea Garden, 0 ,From JPY ¥600,"In stock, 4 units",https://yunomi.life//collections/green-tea/products/kajihara-tea-garden-densho-premium-kamairicha-green-tea-from-kumamoto
149,Ayumi Farms (Cyittorattu): Wha-ha-ha Three Year Bancha (100g),Ayumi Farms, 0 ,From JPY ¥499,Available,https://yunomi.life//collections/green-tea/products/ayumi-farms-wa-ha-ha-three-year-bancha
150,"Kajihara Tea Garden: #02 Densho, Kamairicha Green Tea from Kumamoto 伝承 釜炒り茶",Kajihara Tea Garden, 1 ,"JPY ¥1,000",Available,https://yunomi.life//collections/green-tea/products/densho
151,Kajihara Tea Garden: #04 Homemade Lemongrass and Kamairicha Herb Tea,Kajihara Tea Garden, 0 ,"JPY ¥1,000",Available,https://yunomi.life//collections/green-tea/products/homemade-lemongrass-and-kamairicha-herb-tea
152,"Cultivar Comparison (10g x 10 types): Azuma Tea Garden Stone Milled Matcha Sampler (June Grinding, Standard Ceremonial Grade)",Azuma Tea Garden, 7 ,"JPY ¥10,000","In stock, 15 units",https://yunomi.life//collections/green-tea/products/cultivar-comparison-10g-x-10-types-azuma-tea-garden-matcha
153,"Furuichi Seicha: #10 Organic Sencha from Chiran Village, Silver Label 知覧茶 有機栽培茶『銀印』",Furuichi Seicha, 1 ,From JPY ¥400,"In stock, 13 units",https://yunomi.life//collections/green-tea/products/furuichi-seicha-organic-sencha-from-chiran-village-silver-label
154,"Furuichi Seicha: #09 Organic Sencha from Chiran Village, Gold Label 知覧茶 有機栽培茶『金印』",Furuichi Seicha, 0 ,From JPY ¥600,Available,https://yunomi.life//collections/green-tea/products/furuichi-seicha-organic-sencha-from-chiran-village-gold-label
155,Bizenya: #01 Kohaku 21g - Sayama Green Oolong Tea 琥珀,Bizenya, 0 ,JPY ¥999,Available,https://yunomi.life//collections/green-tea/products/bizenya-kohaku-sayama-green-oolong-tea
156,Nakamura-en #07: Kyoto Gyokuro　京都玉露,Nakamura-en, 1 ,"From JPY ¥1,000","In stock, 4 units",https://yunomi.life//collections/green-tea/products/nakamura-en-07-kyoto-gyokuro
157,"Shogyokuen: Matcha Hatsu Mukashi, Imperial Ceremonial Grade (40g can, Spring Harvest) 初昔",Shogyokuen Tea Factory, 0 ,"JPY ¥3,499",Available,https://yunomi.life//collections/green-tea/products/shogyokuen-matcha-hatsu-mukashi-imperial-ceremonial-grade
158,"Withered Sencha Green Tea  - #01 Yume Wakaba, Single Cultivar by Okutomi Tea Garden",Okutomi Tea Garden, 2 ,From JPY ¥800,Available,https://yunomi.life//collections/green-tea/products/withered-sencha-green-tea-yume-wakaba-single-cultivar-by-okutomi-tea-garden
159,"Withered Sencha Green Tea - #03 Hokumei, Single Cultivar by Okutomi Tea Garden",Okutomi Tea Garden, 0 ,From JPY ¥600,Available,https://yunomi.life//collections/green-tea/products/withered-sencha-green-tea-hokumei-single-cultivar-by-okutomi-tea-garden
160,"Shogyokuen: Matcha Iwai no Shiro, Premium Ceremonial Grade (40g can, Spring Harvest) 祝いの白",Shogyokuen Tea Factory, 2 ,"From JPY ¥2,499",Available,https://yunomi.life//collections/green-tea/products/shogyokuen-matcha-iwai-no-shiro-premium-ceremonial-grade
161,"Withered Sencha Green Tea - #02 Fukumidori, Single Cultivar by Okutomi Tea Garden",Okutomi Tea Garden, 0 ,From JPY ¥600,Available,https://yunomi.life//collections/green-tea/products/withered-sencha-green-tea-fukumidori-single-cultivar-by-okutomi-tea-garden
162,"Withered Sencha Green Tea - #04 Okuharuka, Single Cultivar by Okutomi Tea Garden",Okutomi Tea Garden, 1 ,From JPY ¥600,Available,https://yunomi.life//collections/green-tea/products/withered-sencha-green-tea-okuharuka-single-cultivar-by-okutomi-tea-garden
163,Okada Tea Farm: Organic Fukamushicha Green Tea Mahoroba 有機深蒸し茶まほろうば,Okada Tea Farm, 2 ,From JPY ¥500,Available,https://yunomi.life//collections/green-tea/products/okada-tea-farm-organic-fukamushi-mahoroba
164,Okada Tea Farm: Naturally Grown Hojicha Roasted Green Tea - Meiko 自然農法産　ほうじ茶　茗香（めいこう）,Okada Tea Farm, 1 ,From JPY ¥499,Available,https://yunomi.life//collections/green-tea/products/okada-tea-farm-naturally-grown-hojicha-meiko
165,"Organic Fukamushicha Green Tea - Nagomi - Okada Tea Farm, Shizuoka 有機煎茶　無施肥　和（なごみ）",Okada Tea Farm, 4 ,"From JPY ¥1,000","In stock, 6 units",https://yunomi.life//collections/green-tea/products/okada-tea-farm-naturally-grown-musehi-fukamushi
166,"Obubu Matcha: Gokou Cultivar (25g) from Wazuka, Kyoto.",Kyoto Obubu Tea Farms, 4 ,"JPY ¥2,499",Available,https://yunomi.life//collections/green-tea/products/obubu-matcha-gokou-cultivar-25g
167,"Hinokuni Kumamoto #02 Premium Tamaryokucha Green Tea, Bessaku 自然茶別作火乃国　上煎茶（玉緑茶）",Hinokuni Kumamoto, 2 ,From JPY ¥800,Available,https://yunomi.life//collections/green-tea/products/hinokuni-kumamoto-premium-tamaryokucha-green-tea-bessaku
168,Tea Farmer Shinichi Kihara: Naturally Grown Kyoto Kabusecha (Single Cultivar Gokou) 自然栽培かぶせ茶ごこう,Shinichi Kihara, 8 ,From JPY ¥750,Available,https://yunomi.life//collections/green-tea/products/kihara-naturally-grown-kabusecha
169,"Hachimanjyu Yakushima Tea: Organic Konacha, Tea Fannings Green Tea from Yakushima, 100g 有機緑茶  粉茶",Hachimanjyu Yakushima Tea, 3 ,JPY ¥800,Available,https://yunomi.life//collections/green-tea/products/hachimanjyu-organic-konacha-tea-fannings-green-tea-from-yakushima
170,Marushige Shimizu Tea Farm: Karigane Leaf Stem Green Tea from Mie  かりがね,Marushige Shimizu Tea Farm, 4 ,From JPY ¥680,Available,https://yunomi.life//collections/green-tea/products/marushige-shimizu-karigane-leaf-stem-green-tea-from-mie
171,Uji Moritoku: Instant Matcha Cappuccino,Uji Moritoku, 3 ,From JPY ¥699,Available,https://yunomi.life//collections/green-tea/products/uji-moritoku-instant-matcha-cappucino
172,"Hachimanjyu: Organic Kukicha, Leaf Stems Green Tea from Yakushima 有機茎茶",Hachimanjyu Yakushima Tea, 1 ,JPY ¥499,Available,https://yunomi.life//collections/green-tea/products/hachimanjyu-organic-kukicha-leaf-stems-green-tea-from-yakushima
173,Obubu: Sencha of the Spring Sun 2021,Kyoto Obubu Tea Farms, 5 ,From JPY ¥800,Available,https://yunomi.life//collections/green-tea/products/obubu-02-sencha-of-the-spring-sun-green-tea
174,"Yamane-en: Spring Kabuse Chiran, Kagoshima 知覧かぶせ",Yamane-en, 1 ,From JPY ¥700,Available,https://yunomi.life//collections/green-tea/products/yamane-en-chiran-kabusecha-from-kagoshima
175,Oguri Tea Farms: Makinohara Sencha Yuzu,Oguri Tea Farms, 2 ,From JPY ¥600,Available,https://yunomi.life//collections/green-tea/products/oguri-tea-farm-makinohara-sencha-yuzu
176,Obubu #39: Hojicha Roasted Green Tea Powder for Baking,Kyoto Obubu Tea Farms, 0 ,"JPY ¥5,500",Available,https://yunomi.life//collections/green-tea/products/obubu-39-hojicha-powder-for-baking
177,Kurihara Tea #06: Imperial Sencha Yame Tsuhime 八女津媛,Kurihara Tea Farm, 2 ,JPY ¥580,Available,https://yunomi.life//collections/green-tea/products/kurihara-tea-06-imperial-sencha-yame-tsuhime
178,"Azuma Tea Garden: Tencha Okumidori, Green Tea",Azuma Tea Garden, 0 ,"From JPY ¥1,000",Available,https://yunomi.life//collections/green-tea/products/azuma-tea-garden-tencha-okumidori-green-tea
179,Sueyoshi Tea Atelier #003: Green Hojicha Kaguwashi 末吉銘茶 青焙じ茶 馨し,Sueyoshi Tea Atelier, 5 ,From JPY ¥600,Available,https://yunomi.life//collections/green-tea/products/sueyoshi-tea-atelier-003-green-hojicha
180,AOI Seicha: Gyokuro Konacha 玉露粉茶,AOI Seicha, 1 ,From JPY ¥500,Only 3 units left,https://yunomi.life//collections/green-tea/products/aoi-seicha-gyokuro-konacha
181,AOI Seicha: Heritage Grade Gyokuro for Competition 一期一会／出品玉露,AOI Seicha, 1 ,"From JPY ¥2,500","In stock, 7 units",https://yunomi.life//collections/green-tea/products/aoi-seicha-heritage-grade-gyokuro-for-competition
182,"Takeo Tea Farm: Organic Bancha Green Tea, Satsuki no Aoyanagi (May) 五月の青柳",Takeo Tea Farm, 5 ,From JPY ¥600,Available,https://yunomi.life//collections/green-tea/products/takeo-tea-farm-organic-bancha-green-tea-aoyanagi-may-spring-harvest
183,Takeo Tea Farm: Organic Bancha Green Tea (Autumn),Takeo Tea Farm, 3 ,From JPY ¥400,Available,https://yunomi.life//collections/green-tea/products/takeo-tea-farm-organic-bancha-green-tea-autumn
184,Kizoku Club: Black Bizen-yaki Mini Matcha Bowl,Kizoku Club, 0 ,"JPY ¥1,500","In stock, 4 units",https://yunomi.life//collections/green-tea/products/kizoku-club-black-bizen-yaki-matcha-bowl
185,"Shogyokuen: Heritage Grade Matcha, Zuisho (40g can, Spring Harvest) 瑞祥",Shogyokuen Tea Factory, 3 ,"JPY ¥8,500",Available,https://yunomi.life//collections/green-tea/products/shogyokuen-matcha-zuisho
186,Furuichi Seicha: #06 Satsumakaori Sencha Green Tea G05 さつまかおり,Furuichi Seicha, 2 ,"JPY ¥1,100","In stock, 5 units",https://yunomi.life//collections/green-tea/products/furuichi-seicha-satsumakaori-sencha-green-tea
187,"Kurihara Tea #22: Hachijyuhachiya Shincha - May 1st, 2021, Harvested Sencha 八十八夜新茶",Kurihara Tea Farm, 2 ,From JPY ¥700,Available,https://yunomi.life//collections/green-tea/products/kurihara-tea-hachijyuhachiya-shincha
188,"Takeo Tea Farm: Organic Spring Sencha Green Tea, Kodawari #2 Premium 特上こだわり",Takeo Tea Farm, 3 ,From JPY ¥500,Available,https://yunomi.life//collections/green-tea/products/takeo-tea-farm-organic-spring-sencha-green-tea-kodawari-2-premium
189,Tomizawa Tea Garden: Kabusecha Okumidori かぶせ茶　富茶華（とみさわ） おくみどり,Tomizawa Tea Garden, 4 ,From JPY ¥700,"In stock, 7 units",https://yunomi.life//collections/green-tea/products/tomizawa-tea-garden-kabusecha-okumidori-kumamoto-guricha-green-tea
190,Yamane-en: Gyokuro Konacha 玉露 粉茶,Yamane-en, 0 ,From JPY ¥400,Available,https://yunomi.life//collections/green-tea/products/yamane-en-gyokuro-konacha
191,Yunomi Discoveries: Mystery Tea Flights Sampler Set,Yunomi Tea, 0 ,"From JPY ¥1,499",Available,https://yunomi.life//collections/green-tea/products/yunomi-mystery-tea-flights
192,Kaneroku Matsumoto Tea Garden: Whisky Oak Barrel Wood Smoked Hojicha 燻製焙茶 洋酒樽,Kaneroku Matsumoto Tea Garden, 0 ,From JPY ¥850,Available,https://yunomi.life//collections/green-tea/products/kaneroku-matsumoto-tea-garden-whisky-barrel-wood-smoked-hojicha-2018
193,"Takeo Tea Farm: Hojicha Roasted Green Tea, Superior (Summer) 上ほうじ茶",Takeo Tea Farm, 3 ,"From JPY ¥1,180",Available,https://yunomi.life//collections/green-tea/products/takeo-tea-farm-hojicha-roasted-green-tea-superior-summer
194,"Nama Toubancha: Non-Steamed Green Tea from Ocha no Sankoen, Shimane, Japan",Ocha no Sankoen, 0 ,From JPY ¥400,"In stock, 4 units",https://yunomi.life//collections/green-tea/products/toubancha
195,Zenkouen Tea Garden: #01 Daichi no Meicha - Imperial Grade 極上 Shizuoka Sencha (JAS Organic),Zenkouen Tea Garden, 1 ,From JPY ¥900,Available,https://yunomi.life//collections/green-tea/products/imperial-grade-shizuoka-sencha-daichi-no-meicha-by-zenkouen-tea-garden
196,Kaneroku Matsumoto Tea Garden: Imperial Fukamushicha,Kaneroku Matsumoto Tea Garden, 1 ,From JPY ¥480,Available,https://yunomi.life//collections/green-tea/products/kaneroku-matsumoto-tea-garden-imperial-fukamushicha
197,Nishide G20: Modern Heritage Uji Gyokuro 特上宇治玉露,Nishide Tea Factory, 1 ,"From JPY ¥1,100",Available,https://yunomi.life//collections/green-tea/products/nishide-modern-heritage-gyokuro
198,"Obubu #11: Hojicha (Basic Roast), Roasted Green Tea",Kyoto Obubu Tea Farms, 1 ,From JPY ¥975,Available,https://yunomi.life//collections/green-tea/products/obubu-11-hojicha-basic-roast-roasted-green-tea
199,"Nishide: Heritage Grade Uji Matcha Kuwari, Stone mill ground 20g 宇治田原産抹茶・久和利",Nishide Tea Factory, 1 ,"JPY ¥2,280",Only 1 unit left,https://yunomi.life//collections/green-tea/products/nishide-heritage-grade-uji-matcha-kuwari-stone-mill-ground
200,Zenkouen Tea Garden: #02 Daichi no Meicha - Premium Grade 特選 Shizuoka Sencha (JAS Organic),Zenkouen Tea Garden, 0 ,From JPY ¥700,Only 2 units left,https://yunomi.life//collections/green-tea/products/premium-grade-shizuoka-sencha-daichi-no-meicha-by-zenkouen-tea-garden-jas-organic
201,Hinokuni Kumamoto #03 Organic Kukicha Tamaryokucha - Midori - Spring Flush Green Tea with Leaf Stems　自然茶火乃国　煎茶（玉緑茶）,Hinokuni Kumamoto, 1 ,JPY ¥500,Available,https://yunomi.life//collections/green-tea/products/hinokuni-kumamoto-kukicha-tamaryokucha-midori-spring-flush-green-tea-with-leaf-stems
202,Matcha Bamboo Whisk - Rikyu Chasen,Yunomi Lifestyle, 0 ,"JPY ¥3,200","In stock, 6 units",https://yunomi.life//collections/green-tea/products/matcha-bamboo-whisk-rikyu-chasen
203,"NaturaliTea: Genmaicha (Brown Rice Green Tea) with Matcha, Grown Pesticide Free 抹茶いり玄米茶",NaturaliTea, 0 ,"From JPY ¥1,200",Available,https://yunomi.life//collections/green-tea/products/naturalitea-genmaicha-brown-rice-green-tea-with-matcha-grown-pesticide-free
204,"Morita Tea Garden #01: Premium Sayama Sencha, Suiren 睡蓮",Morita Tea Garden, 5 ,JPY ¥499,Available,https://yunomi.life//collections/green-tea/products/fujiichi-morita-01-premium-sayama-sencha-suiren
205,"KU005 Tomizawa Tea Garden: Kumamoto Shira-ore Leaf Stem Tea - ""Green Tea.Lab"" 部02 白折",Tomizawa Tea Garden, 2 ,From JPY ¥400,Available,https://yunomi.life//collections/green-tea/products/tomizawa-tea-garden-kumamoto-shira-ore-leaf-stem-tea
206,"KU006 Tomizawa Tea Garden: Kabusecha Saeakari Kumamoto Guricha ""Green Tea.Lab"" かぶせ茶",Tomizawa Tea Garden, 0 ,From JPY ¥700,Only 3 units left,https://yunomi.life//collections/green-tea/products/ku006-tomizawa-tea-garden-kabusecha-saeakari-kumamoto-guricha-green-tea
207,"JA Kagoshima Chagyo: Chirancha Fukamushi Aracha, Chabatake Afternoon Tea",JA Kagoshima Chagyo, 0 ,"JPY ¥1,799",Available,https://yunomi.life//collections/green-tea/products/ja-kagoshima-chagyo-chirancha-fukamushi-aracha-chabatake-afternoon-tea
208,Kurihara Tea #11: Imperial Shiraore Stem Tea 極上白折,Kurihara Tea Farm, 4 ,From JPY ¥500,Available,https://yunomi.life//collections/green-tea/products/kurihara-tea-11-imperial-shira-ore-stem-tea
209,Obubu Tea #19: Excellent Culinary Grade Matcha,Kyoto Obubu Tea Farms, 0 ,"From JPY ¥11,500",Available,https://yunomi.life//collections/green-tea/products/obubu-19-excellent-kitchen-grade-matcha
210,Zenkouen Tea Garden: #12 Marugoto Series - Hojicha Powder (50g),Zenkouen Tea Garden, 1 ,"From JPY ¥1,280",Available,https://yunomi.life//collections/green-tea/products/zenkouen-tea-gardens-marugoto-series-hojicha-powder-50g
211,Furuichi Seicha: #08 Limited Edition 2021 Shincha Kagoshima First Flush Fukamushicha 鹿児島茶新茶,Furuichi Seicha, 1 ,From JPY ¥600,"In stock, 9 units",https://yunomi.life//collections/green-tea/products/furuichi-seicha-limited-edition-shincha-kagoshima-first-flush-fukamushicha
212,Uejima Tea Farm: Wazuka Sencha Superior Samidori 上煎茶,Uejima Tea Farm, 1 ,"JPY ¥1,999","In stock, 10 units",https://yunomi.life//collections/green-tea/products/uejima-tea-farm-wazuka-sencha-superior
213,"Murata Tea Garden: Hashiri Shincha (Yabukita) From Kikugawa, Shizuoka",Murata Tea Garden, 0 ,From JPY ¥800,"In stock, 6 units",https://yunomi.life//collections/green-tea/products/murata-tea-garden-hashiri-shincha-from-kikugawa-shizuoka
214,Tarui Tea Farm: Organic Sencha - Chouseiden - Single Cultivar Shizu 7132　有機 長生殿,Tarui Tea Farm, 5 ,"From JPY ¥1,100","In stock, 5 units",https://yunomi.life//collections/green-tea/products/tarui-family-organic-sencha-chouseiden
215,Furyu: Tosa Bancha ふりゅう 土佐番茶,Furyu Bancha Specialty Shop, 7 ,From JPY ¥300,Available,https://yunomi.life//collections/green-tea/products/furyu-tosa-bancha
216,Ashikubo Teaworks: Asamushi Sencha Kiri no Kaori 足久保  浅蒸し茶  霧の香,Ashikubo Teaworks, 1 ,From JPY ¥600,"In stock, 4 units",https://yunomi.life//collections/green-tea/products/asamushi-sencha-kiri-no-kaori-by-ashikubo-teaworks
217,Seikoen Tea Factory: Snow-Aged Yukimuro Genmaicha with Matcha 雪室こめ茶,Seikoen, 1 ,From JPY ¥500,"In stock, 16 units",https://yunomi.life//collections/green-tea/products/seikoen-tea-factory-snow-aged-yukimuro-genmaicha-with-matcha
218,NaturaliTea #11: Autumn Bancha Green Tea,NaturaliTea, 0 ,From JPY ¥500,Available,https://yunomi.life//collections/green-tea/products/naturalitea-11-autumn-bancha-green-tea
