,tea_name,tea_origin,tea_star,tea_price,tea_availability,tea_link
0,"Hachimanjyu: Naturally Grown ""Hisoka"", Spring First Flush Green Tea (Yutaka Midori)",Hachimanjyu Yakushima Tea, 10 ,From JPY ¥600,Available,https://yunomi.life//collections/green-tea/products/hachimanjyu-naturally-grown-hisoka-spring-first-flush-green-tea-yutaka-midori
1,Kurihara Tea #01: Takumi 匠 (The Artisan) - Kurihara Heritage Gyokuro Green Tea,Kurihara Tea Farm, 11 ,"From JPY ¥1,000",Available,https://yunomi.life//collections/green-tea/products/kurihara-tea-01-kurihara-heritage-gyokuro-green-tea
2,"Nakamura-en #01: Gyokuro Mecha, The Discovery 玉露芽茶",Nakamura-en, 36 ,From JPY ¥600,"In stock, 13 units",https://yunomi.life//collections/green-tea/products/nakamura-en-01-gyokuro-mecha-the-discovery
3,"Yunomi Matcha: Uji no Aji - Kiyomizu, Standard Ceremonial Grade (30g)",Yunomi Tea, 19 ,"From JPY ¥1,999",Available,https://yunomi.life//collections/green-tea/products/yunomi-matcha-uji-no-aji-kiyomizu-standard-ceremonial-grade-30g
4,Kurihara Tea #03: Shin 心 (Heart) - Premium Gyokuro Green Tea,Kurihara Tea Farm, 12 ,From JPY ¥999,Available,https://yunomi.life//collections/green-tea/products/kurihara-tea-03-premium-gyokuro-green-tea
5,"NaturaliTea #19: Mountain-grown Fukamushi Sencha, Yabukita 有機一番摘み煎茶　山の深蒸し　やぶきたみどり",NaturaliTea, 12 ,From JPY ¥600,Available,https://yunomi.life//collections/green-tea/products/naturalitea-19-mountain-grown-fukamushi-sencha-yabukita
6,"Yunomi Matcha: Uji no Aji - Kibune, Imperial Ceremonial Grade (30g)",Yunomi Tea, 14 ,"From JPY ¥2,999",Available,https://yunomi.life//collections/green-tea/products/yunomi-matcha-uji-matcha-imperial-ceremonial-grade
7,Yunomi Matcha Naturally Grown - Premium Ceremonial Grade,Yunomi Tea, 16 ,"JPY ¥1,999",Available,https://yunomi.life//collections/green-tea/products/yunomi-matcha-naturally-grown-premium-ceremonial-grade
8,ON SALE! Yunomi House Blend Green Tea 100g - YUG01,Yunomi Tea, 16 ,From JPY ¥699,Available,https://yunomi.life//collections/green-tea/products/yunomi-house-blend-green-tea
9,Kurihara Tea #04: Mountain-Grown Yamecha Kabusecha Green Tea かぶせ茶,Kurihara Tea Farm, 11 ,From JPY ¥600,Available,https://yunomi.life//collections/green-tea/products/kurihara-tea-04-kabusecha-green-tea
10,Obubu #12: Hojicha (Dark Roast),Kyoto Obubu Tea Farms, 7 ,From JPY ¥975,Available,https://yunomi.life//collections/green-tea/products/obubu-12-hojicha-dark-roast
11,Kurihara Tea #09: Superior Sencha Hime Kaori 媛かおり,Kurihara Tea Farm, 7 ,From JPY ¥400,Available,https://yunomi.life//collections/green-tea/products/kurihara-tea-09-superior-sencha-hime-kaori
12,Hachimanjyu: Organic Yakushima Premium Spring Sencha Green Tea (Yabukita & Asatsuyu) 屋久島茶  有機緑茶,Hachimanjyu Yakushima Tea, 9 ,From JPY ¥600,Available,https://yunomi.life//collections/green-tea/products/hachimanjyu-organic-yakushima-premium-sencha-green-tea-spring-yabukita-asatsuyu
13,"Shogyokuen: Matcha Izumi no Shiro, Premium Ceremonial Grade (Spring Harvest) 泉の白",Shogyokuen Tea Factory, 11 ,"From JPY ¥1,999",Available,https://yunomi.life//collections/green-tea/products/shogyokuen-matcha-izumi-no-shiro-premium-ceremonial-grade
14,Nakayama Stoneworks: Personal Matcha Stone Mill (Large). Express Airmail Shipping Included.,Nakayama Stoneworks, 0 ,"JPY ¥145,000",Available,https://yunomi.life//collections/green-tea/products/personal-matcha-stone-mill-large
15,Sawa Houzan: Shigaraki-yaki Shiboridashi Teapot for One,Sawa Houzan, 14 ,"JPY ¥5,999","In stock, 6 units",https://yunomi.life//collections/green-tea/products/sawa-houzan-shigaraki-yaki-shiboridashi-teapot-for-one
16,Yamane-en: Kakegawa Fukamushicha Black Label 特選ブラック掛川茶,Yamane-en, 5 ,From JPY ¥600,Available,https://yunomi.life//collections/green-tea/products/yamane-en-kakegawa-fukamushi
17,NaturaliTea #01: Hatsutsumi Midori Shincha First Flush 有機浅蒸し煎茶: 初摘みみどり,NaturaliTea, 8 ,From JPY ¥980,Available,https://yunomi.life//collections/green-tea/products/naturalitea-01-handpicked-midori-first-flush
18,Kurihara Tea #02: Den 伝 (Tradition) - Heritage Gyokuro Green Tea,Kurihara Tea Farm, 7 ,"From JPY ¥1,200",Available,https://yunomi.life//collections/green-tea/products/kurihara-tea-02-heritage-gyokuro-green-tea
19,Chasandai: Sakura Sencha with Sugared Sakura Leaves 桜煎茶,Chasandai Tea Factory, 12 ,"From JPY ¥1,380",Available,https://yunomi.life//collections/green-tea/products/chasandai-sakura-sencha-with-sugared-sakura-leaves
20,Uejima Tea Farm: Uji Kyotanabe Premium Gyokuro 京都宇治特上玉露京田辺,Uejima Tea Farm, 4 ,From JPY ¥800,"In stock, 10 units",https://yunomi.life//collections/green-tea/products/uejima-tea-farm-uji-kyotanabe-gyokuro
21,"Nakamura-en #02: Gyokuro Konacha, The Discovery 玉露粉茶",Nakamura-en, 19 ,From JPY ¥400,"In stock, 4 units",https://yunomi.life//collections/green-tea/products/nakamura-en-02-gyokuro-konacha-the-discovery
22,Yunomi Matcha: Premium Culinary Grade Matcha,Yunomi Tea, 7 ,"From JPY ¥1,180",Available,https://yunomi.life//collections/green-tea/products/yunomi-matcha-premium-culinary-grade-matcha
23,Hachimanjyu Yakushima Tea: Early Spring First Flush Green Tea 屋久島 新茶,Hachimanjyu Yakushima Tea, 4 ,From JPY ¥800,Available,https://yunomi.life//collections/green-tea/products/hachimanjyu-yakushima-tea-early-spring-first-flush-green-tea-naturally-grown-kuritawase-asatsuyu-blend
24,"Tarui Tea Farm: Organic Sencha - Shurei, Elegant Beauty  有機 秀麗",Tarui Tea Farm, 4 ,From JPY ¥500,"In stock, 10 units",https://yunomi.life//collections/green-tea/products/tarui-family-organic-sencha-shurei-elegant-beauty
25,"Tarui Tea Farm: Organic Sencha Ranryu, The Orchid Dragon - Single Cultivar Inzatsu #131　有機 蘭龍",Tarui Tea Farm, 8 ,"From JPY ¥1,200",Only 2 units left,https://yunomi.life//collections/green-tea/products/tarui-family-organic-sencha-ranryu-the-orchid-dragon
26,"Shogyokuen: Premium Gyokuro, Fuji no Tsuyu 富士の露",Shogyokuen Tea Factory, 8 ,"From JPY ¥1,000",Available,https://yunomi.life//collections/green-tea/products/shogyokuen-premium-gyokuro-fuji-no-tsuyu
27,Obubu Tea: Sakura Flowers Herbal Tea,Kyoto Obubu Tea Farms, 1 ,From JPY ¥249,Available,https://yunomi.life//collections/green-tea/products/obubu-tea-sakura-flowers-herbal-tea-100g
28,Obubu GE01: Genmaicha Brown Rice Tea,Kyoto Obubu Tea Farms, 10 ,From JPY ¥799,Available,https://yunomi.life//collections/green-tea/products/obubu-16-genmaicha-brown-rice-tea
29,"Yamane-en: Sugabow, Gyokuro Karigane Hojicha",Yamane-en, 5 ,From JPY ¥500,Available,https://yunomi.life//collections/green-tea/products/yamane-en-sugabou-gyokuro-karigane-hojicha
30,"KU001 Tomizawa Tea Garden: 2021 Kabusecha Yabukita Kumamoto Guricha ""Green Tea.Lab"" 単01 薮北 かぶせ茶",Tomizawa Tea Garden, 7 ,From JPY ¥499,Available,https://yunomi.life//collections/green-tea/products/tomizawa-tea-garden-kabusecha-yabukita-kumamoto-guricha-green-tea
31,"KU004 Tomizawa Tea Garden: 2021 Kabusecha Okuyutaka Kumamoto Guricha ""Green Tea.Lab"" かぶせ茶",Tomizawa Tea Garden, 7 ,From JPY ¥800,Available,https://yunomi.life//collections/green-tea/products/tomizawa-tea-garden-kabusecha-okuyutaka-kumamoto-guricha-green-tea
32,Yunomi Matcha Naturally Grown - Basic Ceremonial Grade,Yunomi Tea, 10 ,"From JPY ¥1,499",Available,https://yunomi.life//collections/green-tea/products/yunomi-matcha-naturally-grown-basic-ceremonial-grade
33,Furuichi Seicha #12: 2021 Warakake - Straw Shaded Fukamushicha by Farmer Kuwazuru Sumiyoshi わらかけ,Furuichi Seicha, 5 ,From JPY ¥700,"In stock, 7 units",https://yunomi.life//collections/green-tea/products/furuichi-seicha-warakake-straw-shaded-fukamushicha
34,Furuichi Seicha: #13 Karigane Kukicha Green Tea かりがね(茎茶),Furuichi Seicha, 9 ,From JPY ¥500,Available,https://yunomi.life//collections/green-tea/products/furuichi-seicha-kukicha-green-tea-200-g
35,Nishide OG18: Organic Uji Gyokuro 宇治茶 有機玉露,Nishide Tea Factory, 4 ,"From JPY ¥1,000",Available,https://yunomi.life//collections/green-tea/products/nishide-organic-uji-gyokuro
36,"Cultivar Comparison (30g x 3 types, 26% off): Azuma Tea Garden Matcha Sampler - Kanaya Midori, Okumidori, and Samidori",Azuma Tea Garden, 2 ,"JPY ¥4,999",Available,https://yunomi.life//collections/green-tea/products/azuma-matcha-cultivar-series-set
37,Furyu: Bancha Goishicha ふりゅう 碁石茶,Furyu Bancha Specialty Shop, 12 ,From JPY ¥700,Available,https://yunomi.life//collections/green-tea/products/furyu-bancha-goishicha
38,"Kanes Tea: Honyama Togen ""Marishi"" - Limited Handpicked First Flush, Spring 2021 本山桃源",Kanes Tea Factory, 0 ,"JPY ¥3,999","In stock, 16 units",https://yunomi.life//collections/green-tea/products/kanes-tea-honyama-togen-marishi-limited-handpicked-first-flush-spring
39,Dokodemosora #01: Naturally Grown Wakayama Tamaryokucha,Dokodemosora Tea Farm, 8 ,"From JPY ¥1,499",Available,https://yunomi.life//collections/green-tea/products/dokodemosora-01-naturally-grown-wakayama-tamaryokucha
40,Obubu Tea: Hojicha Gold Roast,Kyoto Obubu Tea Farms, 4 ,From JPY ¥680,Available,https://yunomi.life//collections/green-tea/products/obubu-tea-houjicha-gold-roast
41,Hachimanjyu: Organic Yakushima Standard Unshaded Spring Sencha 有機屋久島茶路地栽培,Hachimanjyu Yakushima Tea, 6 ,From JPY ¥430,Available,https://yunomi.life//collections/green-tea/products/hachimanjyu-organic-yakushima-standard-sencha-green-tea
42,Kaneroku Matsumoto Tea Garden: Wasencha Midori Sencha Green Tea　和煎茶みどり,Kaneroku Matsumoto Tea Garden, 2 ,From JPY ¥580,Available,https://yunomi.life//collections/green-tea/products/kaneroku-matsumoto-tea-garden-wasencha-midori-fukamushicha
43,"NaturaliTea #02: Sencha Green Tea, Spring Midori First Flush 春の香みどり",NaturaliTea, 1 ,From JPY ¥950,Available,https://yunomi.life//collections/green-tea/products/naturalitea-02-sencha-green-tea-spring-midori-first-flush-2014-2015
44,"Shogyokuen: Heritage Gyokuro, Kyoto Shogyoku, Special Selection　特製祥玉",Shogyokuen Tea Factory, 5 ,"From JPY ¥1,500",Available,https://yunomi.life//collections/green-tea/products/shogyokuen-heritage-gyokuro-kyoto-shogyoku-special-selection
45,Miyano Tea Factory: 2020 Imperial Handpicked Sayama Sencha 極上品 手摘み茶,Miyano Tea Factory, 1 ,"From JPY ¥1,100",Available,https://yunomi.life//collections/green-tea/products/miyano-tea-factory-imperial-handpicked-sayama-sencha
46,"Takeo Tea Farm: Organic Spring Sencha Green Tea, Kodawari #3 Superior 上こだわり",Takeo Tea Farm, 9 ,From JPY ¥899,Available,https://yunomi.life//collections/green-tea/products/takeo-tea-farm-organic-spring-sencha-green-tea-kodawari-3-superior
47,"Obubu: Kabuse Sencha, Shaded Spring Green Tea",Kyoto Obubu Tea Farms, 7 ,From JPY ¥600,Available,https://yunomi.life//collections/green-tea/products/obubu-01-kabuse-sencha-shaded-spring-green-tea
48,"Kyoto Kouyoucha, Ume shiso konbu matcha blend by Kouyoudo - 2g x 12 packets",Kouyoudo, 10 ,"JPY ¥1,180",Available,https://yunomi.life//collections/green-tea/products/kouyoudo-kouyoucha-ume-shiso-konbu-matcha-blend-from-kyoto
49,"Kanaya Shuho 金谷秀峰 by Kanes Tea Factory, Limited Handrolled First Flush, April 2021 Asamushicha",Kanes Tea Factory, 1 ,"JPY ¥3,999","In stock, 17 units",https://yunomi.life//collections/green-tea/products/kanaya-shuho-by-kanes-tea-factory-limited-handrolled-first-flush-spring-asamushicha
50,Miyano Tea Factory: Sayama Premium Gyokuro 狭山本玉露,Miyano Tea Factory, 0 ,"From JPY ¥1,000",Available,https://yunomi.life//collections/green-tea/products/miyano-tea-factory-sayama-premium-gyokuro
51,Miyano Tea Factory: Sayama Heritage Gyokuro 特上品 狭山本玉露,Miyano Tea Factory, 1 ,"From JPY ¥1,200",Available,https://yunomi.life//collections/green-tea/products/miyano-tea-factory-sayama-heritage-gyokuro
52,"Obubu Matcha: Uji Hikari Cultivar (25g) from Wazuka, Kyoto.",Kyoto Obubu Tea Farms, 3 ,"JPY ¥2,499",Available,https://yunomi.life//collections/green-tea/products/obubu-matcha-uji-hikari-cultivar-25g
53,"Shogyokuen: Matcha Shogyoku, Imperial Ceremonial Grade (40g can, Spring Harvest) 祥玉",Shogyokuen Tea Factory, 4 ,"From JPY ¥4,500",Available,https://yunomi.life//collections/green-tea/products/shogyokuen-matcha-shogyoku
54,Tea Farmer Shinichi Kihara SKH003: Naturally Grown Kyobancha 京番茶 (Winter-roasted green tea leaves),Shinichi Kihara, 11 ,From JPY ¥500,Available,https://yunomi.life//collections/green-tea/products/kihara-naturally-grown-kyobancha-winter-roasted-green-tea-leaves
55,Furyu: Awa Bancha ふりゅう 阿波番茶,Furyu Bancha Specialty Shop, 4 ,From JPY ¥400,Available,https://yunomi.life//collections/green-tea/products/furyu-awa-bancha
56,"Furuichi Seicha: #02 Organic Kagoshima Sencha, Midori no Daichi (Wa) かごしま　有機緑茶『みどりの大地(和）』",Furuichi Seicha, 4 ,From JPY ¥500,Available,https://yunomi.life//collections/green-tea/products/furuichi-seicha-organic-kagoshima-sencha-midori-no-daichi-wa
57,"Shogyokuen: Heritage Grade Matcha, Kakuun (40g can, Spring Harvest) 鶴雲",Shogyokuen Tea Factory, 1 ,"JPY ¥6,500",Available,https://yunomi.life//collections/green-tea/products/shogyokuen-heritage-grade-matcha-kakuun-40g-can
58,"Morita Tea Garden #02: Sayama Sencha, Kakurei 鶴齢",Morita Tea Garden, 15 ,From JPY ¥650,Available,https://yunomi.life//collections/green-tea/products/fujiichi-morita-02-sayama-sencha-kakurei
59,Matcha Bamboo Whisk (Chasen) - Small Size for 野点 - noten - outdoor use,Yunomi Lifestyle, 0 ,"JPY ¥1,500","In stock, 21 units",https://yunomi.life//collections/green-tea/products/matcha-bamboo-whisk-chasen-small
60,Nishide G10: Standard Uji Gyokuro 宇治玉露,Nishide Tea Factory, 6 ,From JPY ¥600,Available,https://yunomi.life//collections/green-tea/products/nishide-uji-gyokuro
61,"Nakai Tea Farm: Uji Matcha Seisho (Okumidori) Standard Ceremonial Grade, Wazuka, Kyoto",Nakai Tea Farm, 2 ,"JPY ¥1,799",Available,https://yunomi.life//collections/green-tea/products/nakai-tea-farm-ceremonial-matcha-seisho
62,Nishide G15: Superior Uji Gyokuro 上宇治玉露,Nishide Tea Factory, 4 ,From JPY ¥800,Available,https://yunomi.life//collections/green-tea/products/nishide-superior-uji-gyokuro
63,NaturaliTea #10: Kukicha Midori (Stem Tea),NaturaliTea, 3 ,From JPY ¥500,Available,https://yunomi.life//collections/green-tea/products/naturalitea-kukicha-midori-stem-tea
64,"NaturaliTea #05: Sencha Green Tea, Setoya Midori 有機一番摘み煎茶　瀬戸谷みどり",NaturaliTea, 3 ,From JPY ¥500,Available,https://yunomi.life//collections/green-tea/products/naturalitea-05-sencha-green-tea-setoya-midori
65,Morita Tea Garden #04: Sayama Karigane (Premium Stem Tea) 雁が音,Morita Tea Garden, 5 ,JPY ¥300,Available,https://yunomi.life//collections/green-tea/products/toichi-morita-04-sayama-karigane-premium-stem-tea
66,"Nishide G30: Competition Grade, Handpicked Uji Gyokuro 宇治茶品評会出品手摘み玉露",Nishide Tea Factory, 3 ,From JPY ¥800,Available,https://yunomi.life//collections/green-tea/products/nishide-competition-grade-uji-gyokuro
67,"KU002 Tomizawa Tea Garden: 2021 Kabusecha Saemidori Kumamoto Guricha ""Green Tea.Lab"" かぶせ茶",Tomizawa Tea Garden, 2 ,JPY ¥500,"In stock, 14 units",https://yunomi.life//collections/green-tea/products/ku002-tomizawa-tea-garden-kabusecha-saemidori-kumamoto-guricha-green-tea
68,"Obubu Matcha: Samidori Cultivar (25g) from Wazuka, Kyoto.",Kyoto Obubu Tea Farms, 1 ,"JPY ¥2,499",Available,https://yunomi.life//collections/green-tea/products/obubu-matcha-samidori-cultivar-25g
69,Hachimanjyu: Organic Yakushima Genmaicha Brown Rice Green Tea 有機玄米茶,Hachimanjyu Yakushima Tea, 2 ,From JPY ¥999,Available,https://yunomi.life//collections/green-tea/products/hachimanjyu-organic-genmaicha-brown-rice-green-tea
70,"NaturaliTea #03: Sencha Green Tea, Yabukita Midori First Flush 有機一番摘み煎茶  やぶきたみどり",NaturaliTea, 5 ,From JPY ¥500,Available,https://yunomi.life//collections/green-tea/products/naturalitea-03-sencha-green-tea-yabukita-midori-first-flush
71,Azuma Tea Garden: Roasted Tencha Hojicha Powder,Azuma Tea Garden, 2 ,"From JPY ¥1,800",Available,https://yunomi.life//collections/green-tea/products/azuma-tea-garden-roasted-tencha-hojicha-powder
72,Nishide G8: Basic Gyokuro from Kyoto 高級玉露,Nishide Tea Factory, 3 ,"From JPY ¥1,799",Available,https://yunomi.life//collections/green-tea/products/nishide-gyokuro
73,Kunitomo: Riguricha Furanka - The Orchid Dragon - Handpicked Kamairicha,Kunitomo Tea Garden, 3 ,From JPY ¥780,Available,https://yunomi.life//collections/green-tea/products/kunitomo-riguricha-furanka-the-orchid-dragon-handpicked-kamairicha
74,Kurihara Tea #08: Premium Sencha Hime Midori 媛みどり,Kurihara Tea Farm, 2 ,From JPY ¥600,Available,https://yunomi.life//collections/green-tea/products/kurihara-tea-08-premium-sencha-hime-midori
75,Kyocera Ceramic Hand Mill for Sencha Green Tea,Yunomi Lifestyle, 1 ,"JPY ¥5,480",Available,https://yunomi.life//collections/green-tea/products/kyocera-ceramic-hand-mill-for-sencha-green-tea
76,"Cultivar Comparison: Obubu Tea - 4 matcha cultivar set (Gokou, Uji Hikari, Samidori, Okumidori)",Kyoto Obubu Tea Farms, 1 ,"JPY ¥8,800",Available,https://yunomi.life//collections/green-tea/products/obubu-tea-matcha-cultivar-set
77,"Sueyoshi Tea Atelier #002: ""Furusato no Hana"" Okumidori Fukamushi Kabusecha from Kagoshima 末吉銘茶 郷里の華 奥みどり",Sueyoshi Tea Atelier, 1 ,"From JPY ¥1,000",Available,https://yunomi.life//collections/green-tea/products/sueyoshi-tea-atelier-002-furusato-no-hana-okumidori-fukamushi-kabusecha-from-kagoshima
78,"Murata Tea Garden: Tsuyuhikari Fukamushicha From Kikugawa, Shizuoka",Murata Tea Garden, 1 ,From JPY ¥680,Available,https://yunomi.life//collections/green-tea/products/murata-tea-garden-tsuyuhikari-fukamushicha-from-kikugawa-shizuoka
79,Obubu GE02: Roasted Rice,Kyoto Obubu Tea Farms, 1 ,From JPY ¥680,Available,https://yunomi.life//collections/green-tea/products/obubu-17-genmai-roasted-brown-rice-for-tea
80,"Takeo Tea Farm: Spring Konacha Green Tea, Ichiban (JAS certified organic) 一番粉茶",Takeo Tea Farm, 4 ,From JPY ¥400,Available,https://yunomi.life//collections/green-tea/products/takeo-tea-farm-spring-konacha-green-tea-ichiban
81,Tarui Tea Farm: Yabukita - Single Cultivar Shizuoka Sencha (JAS Organic) 有機やぶきた,Tarui Tea Farm, 4 ,From JPY ¥700,"In stock, 7 units",https://yunomi.life//collections/green-tea/products/tarui-family-organic-sencha-yabukita
82,"Sueyoshi Tea Atelier #001: ""Furusato no Hana"" Saemidori Fukamushi Kabusecha from Kagoshima 末吉銘茶 郷里の華 さえみどり",Sueyoshi Tea Atelier, 4 ,From JPY ¥600,"In stock, 18 units",https://yunomi.life//collections/green-tea/products/sueyoshi-tea-atelier-001-furusato-no-hana-saemidori-fukamushi-kabusecha-from-kagoshima
83,"Morita Tea Garden #03: ""Hoju"" Aracha Green Tea from Sayama 宝珠",Morita Tea Garden, 5 ,From JPY ¥500,Available,https://yunomi.life//collections/green-tea/products/fujiichi-morita-03-aracha-green-tea-hoju
84,"Furuichi Seicha: #01 Organic Premium Kagoshima Sencha, Midori no Daichi (Jun) みどりの大地（潤）",Furuichi Seicha, 2 ,From JPY ¥500,Available,https://yunomi.life//collections/green-tea/products/furuichi-seicha-organic-premium-kagoshima-sencha-midori-no-daichi-jun
85,Yamane-en: Yuikamatsuka Village Fukamushi Sencha 煎茶 湯日鎌塚,Yamane-en, 2 ,"From JPY ¥1,450",Available,https://yunomi.life//collections/green-tea/products/yamane-en-yuikamatsuka-village-fukamushi-sencha-100g
86,"Ogura Tea Garden: Yabukita Sencha from Ashigara, Kanagawa",Ogura Tea Garden, 4 ,From JPY ¥600,Available,https://yunomi.life//collections/green-tea/products/ogura-tea-garden-yabukita-sencha-from-ashigara-kanagawa
87,Obubu #14: Hojicha Amber Roast 琥珀のほうじ茶,Kyoto Obubu Tea Farms, 3 ,From JPY ¥600,Available,https://yunomi.life//collections/green-tea/products/obubu-14-houjicha-amber-roast
88,Yoshino Tea Garden: Horai Kincha Single Cultivar Sayama Golden Sencha Green Tea　蓬莱錦茶,Yoshino Tea Garden, 5 ,From JPY ¥800,Available,https://yunomi.life//collections/green-tea/products/yoshino-tea-garden-horai-kincha-single-cultivar-sencha-sayama-saitama
89,"NaturaliTea: Genmaicha Brown Rice Green Tea, Grown Pesticide Free 無農薬茶：玄米茶",NaturaliTea, 3 ,From JPY ¥600,Available,https://yunomi.life//collections/green-tea/products/naturalitea-06-genmaicha-brown-rice-green-tea
90,"Yunomi Matcha: Uji no Aji - Yasaka, Premium Ceremonial Grade (30g)",Yunomi Tea, 3 ,"From JPY ¥2,480",Available,https://yunomi.life//collections/green-tea/products/yunomi-matcha-uji-no-aji-yasaka-premium-ceremonial-grade-30g
91,"Yamane-en: First Flush Yutaka Midori Fukamushicha from the Village of Ei, Kagoshima　揖宿頴娃",Yamane-en, 0 ,From JPY ¥500,Available,https://yunomi.life//collections/green-tea/products/yamane-en-first-flush-fukamushicha-from-the-village-of-ei-kagoshima
92,"Seiwa: Resealable stand bag (gold Japanese washi paper, 6 sizes)",Seiwa Packaging, 1 ,From JPY ¥700,Available,https://yunomi.life//collections/green-tea/products/seiwa-resealable-stand-bag-gold-japanese-washi-paper-6-sizes
93,"AOI Seicha: Competition Grade Gyokuro, Gokujyo 一期一会／極上玉露",AOI Seicha, 0 ,"From JPY ¥1,600","In stock, 4 units",https://yunomi.life//collections/green-tea/products/aoi-seicha-imperial-gyokuro-gokujyo
94,Yunomi Tea: Spring Sencha with Matcha Blend,Yunomi Tea, 2 ,From JPY ¥400,Available,https://yunomi.life//collections/green-tea/products/yunomi-factory-direct-spring-sencha-with-matcha-blend
95,Kaneroku Matsumoto Tea Garden: World Heritage Genmaicha 玄米茶,Kaneroku Matsumoto Tea Garden, 2 ,From JPY ¥700,Available,https://yunomi.life//collections/green-tea/products/kaneroku-matsumoto-tea-garden-genmaicha-green-tea-in-a-wooded-box
96,Kurihara Tea #15: Gyokuro Shiraore (Karigane Kukicha) Leaf Stem Tea 玉露白折,Kurihara Tea Farm, 0 ,From JPY ¥600,Available,https://yunomi.life//collections/green-tea/products/kurihara-tea-15-gyokuro-shira-ore-kukicha-stem-tea
97,Shogyokuen: Ichibancha Genmaicha Made with Premium Spring Green Tea,Shogyokuen Tea Factory, 2 ,From JPY ¥400,Available,https://yunomi.life//collections/green-tea/products/shogyokuen-ichibancha-genmaicha
98,Oguri Tea Farms: Makinohara Sencha Sakura 小栗農園　牧之原の桜煎茶,Oguri Tea Farms, 5 ,From JPY ¥600,Available,https://yunomi.life//collections/green-tea/products/oguri-tea-farm-makinohara-sencha-sakura
99,Obubu #20: Premium Culinary Grade Matcha (Stone mill ground)業務用・製菓用 高級宇治抹茶【プレミアム】,Kyoto Obubu Tea Farms, 0 ,"From JPY ¥3,299",Available,https://yunomi.life//collections/green-tea/products/obubu-20-premium-culinary-grade-matcha-stone-mill-ground
100,"Tarui Tea Farm: Sannen Bancha, Roasted Three-Year Aged Tea Stems 三年仕込み 棒番茶",Tarui Tea Farm, 1 ,"From JPY ¥1,200",Available,https://yunomi.life//collections/green-tea/products/tarui-tea-farm-sannen-bancha
101,Seikoen Tea Factory: Snow-Aged Yukimuro Sencha 長期氷温熟成 雪室緑茶,Seikoen, 6 ,From JPY ¥900,"In stock, 15 units",https://yunomi.life//collections/green-tea/products/seikoen-tea-factory-aged-yukimuro-sencha
102,"Nakai Tea Farm: Yabukita Kabusecha from Wazuka, Kyoto. Grown Without Pesticides",Nakai Tea Farm, 1 ,From JPY ¥700,Available,https://yunomi.life//collections/green-tea/products/nakai-tea-farm-kabusecha-from-wazuka-kyoto
103,Yoshino Tea Garden: Sai no Midori Single Cultivar Sayama Sencha Green Tea,Yoshino Tea Garden, 1 ,"JPY ¥2,000",Available,https://yunomi.life//collections/green-tea/products/sai-no-midori-single-cultivar-sencha-sayama-saitama
104,"Takeo Tea Farm: Organic Spring Sencha Green Tea, Kodawari #1 Imperial",Takeo Tea Farm, 4 ,From JPY ¥700,Available,https://yunomi.life//collections/green-tea/products/takeo-tea-farm-organic-spring-sencha-green-tea-kodawari-1-imperial
105,"Kunitomo: Riguricha Ryu - The Mountain Dragon - Handpicked, Wild Kamairicha",Kunitomo Tea Garden, 0 ,"From JPY ¥2,000",Available,https://yunomi.life//collections/green-tea/products/kunitomo-riguricha-ryu-the-mountain-dragon-handpicked-wild-kamairicha
106,NaturaliTea #18: Premium Kabuse Sencha 有機一番摘み煎茶: 冠(かぶせ)茶,NaturaliTea, 1 ,From JPY ¥700,Available,https://yunomi.life//collections/green-tea/products/naturalitea-premium-kabuse-sencha-hako-iri-musume
107,"Furuichi Seicha: #05 Oku-Chiran Sencha, Iki (100g) 奥知覧茶-粋",Furuichi Seicha, 4 ,"From JPY ¥1,200",Only 1 unit left,https://yunomi.life//collections/green-tea/products/furuichi-seicha-oku-chiran-sencha-iki
108,"Yancha: Standard Yabukita Sencha from Aruse Village, Tokushima",Yancha, 1 ,From JPY ¥499,"In stock, 15 units",https://yunomi.life//collections/green-tea/products/yancha-standard-yabukita-sencha-from-aruse-village-tokushima
109,Wakoen Tea Farm: Kagoshima Fukamushicha - Takumi　和香園　深蒸し茶　匠,Wakoen Tea Farm, 0 ,"From JPY ¥1,000",Available,https://yunomi.life//collections/green-tea/products/wakohen-tea-farm-kagoshima-fukamushicha-takumi
110,Wakoen Tea Farm: Kagoshima Fukamushicha - Miyabi　和香園　深蒸し茶　雅,Wakoen Tea Farm, 0 ,From JPY ¥900,Available,https://yunomi.life//collections/green-tea/products/wakohen-tea-farm-kagoshima-fukamushicha-miyabi
111,Wakoen Tea Farm: Kagoshima Fukamushicha - Kaori　和香園　深蒸し茶　薫,Wakoen Tea Farm, 0 ,From JPY ¥700,Available,https://yunomi.life//collections/green-tea/products/wakohen-tea-farm-kagoshima-fukamushicha-kaori
112,Wakoen Tea Farm: Kagoshima Fukamushicha - You　和香園　深蒸し茶　陽,Wakoen Tea Farm, 1 ,From JPY ¥500,Available,https://yunomi.life//collections/green-tea/products/wakohen-tea-farm-kagoshima-fukamushicha-basic
