,tea_name,tea_origin,tea_star,tea_price,tea_availability,tea_link
219,"Chiyonoen Tea Garden: #08 Mountain-Grown Yame Sencha, Hachijyuhachiya 八十八夜",Chiyonoen Tea Garden, 2 ,From JPY ¥700,Available,https://yunomi.life//collections/green-tea/products/chiyonoen-tea-garden-mountain-grown-yame-sencha-hachijyuhachiya
220,Obubu Tea #18: Basic Culinary Grade Matcha,Kyoto Obubu Tea Farms, 0 ,"From JPY ¥7,000",Available,https://yunomi.life//collections/green-tea/products/obubu-tea-18-basic-culinary-grade-matcha
221,Chakouan H1011: Chiran Green Tea Fukamushi Superior 知覧深蒸し上煎茶,Chakouan, 0 ,From JPY ¥500,Available,https://yunomi.life//collections/green-tea/products/chakouan-10-chiran-green-tea-fukamushi-superior
222,Kurihara Tea #07: Imperial Sencha Hime Shizuku 媛しずく,Kurihara Tea Farm, 3 ,From JPY ¥680,Available,https://yunomi.life//collections/green-tea/products/kurihara-tea-07-imperial-sencha-hime-shizuku
223,Chiyonoen Tea Garden: #17 Mountain-Grown Superior Genmaicha 上玄米茶,Chiyonoen Tea Garden, 0 ,From JPY ¥400,"In stock, 13 units",https://yunomi.life//collections/green-tea/products/chiyonoen-tea-garden-mountain-grown-superior-genmaicha
224,"Obubu Culinary Powder Sampler: Matcha, Sencha, Genmaicha, Hojicha, Black Tea Powder",Kyoto Obubu Tea Farms, 1 ,"JPY ¥2,700",Available,https://yunomi.life//collections/green-tea/products/obubu-sampler-set-culinary-powders
225,"Tarui Tea Farm: Organic Fukamushicha Aracha, Unrefined Green-Roasted Tea 有機 荒茶仕上げ",Tarui Tea Farm, 3 ,From JPY ¥400,Available,https://yunomi.life//collections/green-tea/products/tarui-tea-farm-organic-unrefined-green-roasted-aracha-tea
226,"Hachijyuhachiya Fukamushi Sencha by Kanes Tea Factory, Spring 2020",Kanes Tea Factory, 0 ,JPY ¥999,"In stock, 6 units",https://yunomi.life//collections/green-tea/products/hachijyuhachiya-fukamushi-sencha-by-kanes-tea-factory-spring-2020-fukamushi-ships-late-may
227,"Obubu Matcha: Okumidori Cultivar (25g) from Wazuka, Kyoto.",Kyoto Obubu Tea Farms, 1 ,"JPY ¥2,499",Available,https://yunomi.life//collections/green-tea/products/obubu-matcha-okumidori-cultivar-25g
228,Miyano Tea Factory: Obukucha Green Tea with Gold Flakes 70g,Miyano Tea Factory, 1 ,"From JPY ¥2,200",Available,https://yunomi.life//collections/green-tea/products/miyano-tea-factory-obukucha-green-tea-with-gold-flakes
229,Nishide Premium Selection: Gyokuro Samidori by The Nishikawa Tea Farm 宇治田原西川茶園製玉露さみどり,Nishide Tea Factory, 3 ,"From JPY ¥1,200",Available,https://yunomi.life//collections/green-tea/products/nishide-premium-selection-gyokuro-samidori-by-the-nishikawa-tea-farm
230,Chakouan H818: Ureshino Green Tea Kamairicha 嬉野釜炒り茶 180g,Chakouan, 3 ,JPY ¥999,Only 1 unit left,https://yunomi.life//collections/green-tea/products/chakouan-12-ureshino-green-tea-kamairicha
231,Kurihara Tea #17: Okuhikari Yame Sencha おくひかり,Kurihara Tea Farm, 1 ,From JPY ¥700,Available,https://yunomi.life//collections/green-tea/products/kurihara-tea-17-okuhikari-yame-sencha
232,"Obubu Tea's Kyobancha - Winter-grown, Roasted Green Tea",Kyoto Obubu Tea Farms, 0 ,From JPY ¥300,Available,https://yunomi.life//collections/green-tea/products/obubu-15-kyobancha-winter-grown-roasted-green-tea
233,Furyu: Roasted Lemongrass Tea (hand-roasted),Furyu Bancha Specialty Shop, 4 ,From JPY ¥999,Available,https://yunomi.life//collections/green-tea/products/furyu-roasted-lemongrass-tea
234,Zenkouen Tea Garden: #03 Daichi no Meicha - Single Cultivar Kanaya Midori Shizuoka Sencha (JAS Organic) 大地の銘茶、かなやみどり,Zenkouen Tea Garden, 0 ,From JPY ¥800,Available,https://yunomi.life//collections/green-tea/products/zenkouen-tea-garden-daichi-no-meicha-single-cultivar-kanaya-midori-shizuoka-sencha-jas-organic
235,Kurihara Tea #12: Shiraore Stem Tea with Matcha 抹茶入り白折,Kurihara Tea Farm, 4 ,From JPY ¥400,Available,https://yunomi.life//collections/green-tea/products/kurihara-tea-12-shira-ore-stem-tea-with-matcha
236,"#08 Dobashien Kakegawa Series: Single Cultivar Sencha, Asatsuyu 煎茶  朝露",Dobashien Tea Company, 5 ,From JPY ¥500,Available,https://yunomi.life//collections/green-tea/products/dobashien-single-cultivar-sencha-asatsuyu
237,Uji Moritoku: Instant Hojicha Cappuccino,Uji Moritoku, 5 ,From JPY ¥699,Available,https://yunomi.life//collections/green-tea/products/uji-moritoku-instant-hojicha-cappucino
238,Amabito no Moshio Gourmet Matcha Seaweed Salt by Kamagari Bussan,"Kamagari Bussan Co., Ltd.", 0 ,From JPY ¥999,Available,https://yunomi.life//collections/green-tea/products/kamagari-amabito-moshio-gourmet-matcha-salt
239,"Furyu: Mimasaka Bancha, Dark Tea ふりゅう 岡山美作番茶",Furyu Bancha Specialty Shop, 8 ,From JPY ¥300,Available,https://yunomi.life//collections/green-tea/products/furyu-mimasaka-bancha-dark-tea
240,"Kizoku Club: Sencha Tea Cup, Bamboo Grove Motif",Kizoku Club, 3 ,JPY ¥580,Available,https://yunomi.life//collections/green-tea/products/kizoku-club-sencha-tea-cup-bamboo-grove-motif-5-cup-set
241,Kunitomo: Riguricha Choshunka - The Ancient Rose - Handpicked Kamairicha 2014 / 2018 / 2019 / 2020,Kunitomo Tea Garden, 0 ,"From JPY ¥1,300",Available,https://yunomi.life//collections/green-tea/products/kunitomo-riguricha-choshunka-the-ancient-rose-handpicked-kamairicha
242,"AOI Seicha: Imperial Gyokuro, Fukujyu 一期一会／福寿",AOI Seicha, 2 ,"From JPY ¥1,000",Only 2 units left,https://yunomi.life//collections/green-tea/products/aoi-seicha-imperial-gyokuro-fukujyu
243,"Chiyonoen Tea Garden: #14 Mountain-Grown Yame Gyokuro, Premium 高級玉露",Chiyonoen Tea Garden, 0 ,From JPY ¥700,Available,https://yunomi.life//collections/green-tea/products/chiyonoen-tea-garden-mountain-grown-yame-gyokuro-premium
244,"Murata Tea Garden: Kanaya Midori Fukamushicha From Kikugawa, Shizuoka かなやみどり",Murata Tea Garden, 0 ,From JPY ¥680,"In stock, 34 units",https://yunomi.life//collections/green-tea/products/murata-tea-garden-kanaya-midori-fukamushicha-from-kikugawa-shizuoka
245,"Takeo Tea Farm: Organic Bancha Green Tea, Aoyanagi (Summer harvest) 上青柳(夏摘)",Takeo Tea Farm, 4 ,From JPY ¥500,Available,https://yunomi.life//collections/green-tea/products/takeo-tea-farm-organic-bancha-green-tea-aoyanagi-summer-harvest
246,Ashikubo Teaworks: Asamushi Sencha Midori no Kaze 足久保 緑風,Ashikubo Teaworks, 0 ,"JPY ¥1,280",Only 2 units left,https://yunomi.life//collections/green-tea/products/asamushi-sencha-midori-no-kaze-by-ashikubo-teaworks
247,"Seikoen Tea Factory: Echigo Bocha, Roasted Stem Tea with Toasted Rice 越後棒茶",Seikoen, 7 ,From JPY ¥600,"In stock, 10 units",https://yunomi.life//collections/green-tea/products/seikoen-tea-factory-echigo-bocha-roasted-stem-tea
248,Takeo Tea Farm: Spring Sencha Green Tea Powder,Takeo Tea Farm, 0 ,"JPY ¥1,200",Available,https://yunomi.life//collections/green-tea/products/takeo-tea-farm-spring-sencha-green-tea-powder
249,Ashikubo Teaworks: Handpicked Asamushi Sencha Mine no Kaori 足久保 浅蒸し茶 手摘み  峰の香,Ashikubo Teaworks, 0 ,"From JPY ¥1,200","In stock, 5 units",https://yunomi.life//collections/green-tea/products/handpicked-asamushi-sencha-mine-no-kaori-by-ashikubo-teaworks
250,"Marushige Shimizu Tea Farm: Kabusecha Shaded Green Tea, Tobikkiri とびっきりかぶせ",Marushige Shimizu Tea Farm, 3 ,JPY ¥500,Available,https://yunomi.life//collections/green-tea/products/marushige-shimizu-kabusecha-shaded-green-tea-tobikkiri
251,"NaturaliTea #17: Kuradashi Sencha, Fukamidori - Spring 有機深蒸し煎茶：深みどり",NaturaliTea, 5 ,"From JPY ¥1,000",Available,https://yunomi.life//collections/green-tea/products/naturalitea-17-kuradashi-sencha-fukamidori
252,Chasandai: Yuzu Hojicha - Citrus flavored Hojicha Tea Bags (3g x 7 tea bags),Chasandai Tea Factory, 1 ,JPY ¥899,"In stock, 4 units",https://yunomi.life//collections/green-tea/products/chasandai-yuzu-hojicha-green-tea-bags
253,"Marushige Shimizu Tea Farm: Kabusecha Shaded Green Tea, Saemidori さえみどり",Marushige Shimizu Tea Farm, 3 ,From JPY ¥700,"In stock, 7 units",https://yunomi.life//collections/green-tea/products/marushige-shimizu-kabusecha-shaded-green-tea-saemidori
254,"Yokota Tea Garden: Premium Sayamacha Yabukita Sencha, Matsu (Pine)",Yokota Tea Garden, 1 ,From JPY ¥900,Available,https://yunomi.life//collections/green-tea/products/yokota-premium-sayamacha-sencha-matsu-pine
255,"Nagatani Tea: Spring Hojicha - Yuyadani, Kyoto - Single Cultivar Yabukita (JAS Organic, 100g)",Nagatani Tea, 1 ,From JPY ¥499,Available,https://yunomi.life//collections/green-tea/products/nagatani-tea-factory-kyoto-hojicha-grown-pesticide-free
256,"Furuichi Seicha: #04 Oku-Chiran Sencha, Shu - Elegance",Furuichi Seicha, 0 ,From JPY ¥500,Only 3 units left,https://yunomi.life//collections/green-tea/products/furuichi-seicha-oku-chiran-sencha-shu
257,"Hatsutsumi Fukamushi Sencha by Kanes Tea Factory, Spring 2020",Kanes Tea Factory, 0 ,"JPY ¥1,200","In stock, 8 units",https://yunomi.life//collections/green-tea/products/hatsutsumi-fukamushi-sencha-by-kanes-tea-factory-spring-2020-fukamushi-ships-late-may
258,Ocharaka: Hojicha Banana Chocolate Flavored Roasted Green Tea おちゃらかのほうじ茶チョコバナナ,Ocharaka Tea Shop, 1 ,From JPY ¥800,Only 1 unit left,https://yunomi.life//collections/green-tea/products/ocharaka-hojicha-banana-chocolate-flavored-roasted-green-tea
259,Yamane-en: Obukucha with Gold Powder (45g),Yamane-en, 5 ,"JPY ¥1,200",Available,https://yunomi.life//collections/green-tea/products/yamane-en-obukucha-with-gold-powder
260,"JA Kagoshima Chagyo: Chirancha Fukamushicha, Gold Label 知覧茶  金印",JA Kagoshima Chagyo, 3 ,From JPY ¥600,Available,https://yunomi.life//collections/green-tea/products/ja-kagoshima-chagyo-chirancha-gold-label
261,Kunitomo: Riguricha Iwakura - The Stone Throne - Handpicked Kamairicha,Kunitomo Tea Garden, 0 ,From JPY ¥499,Only 1 unit left,https://yunomi.life//collections/green-tea/products/kunitomo-riguricha-iwakura-the-stone-throne-handpicked-kamairicha
262,Miyazaki Sabou MY03: Kamairicha Green Tea - Okumidori Single Cultivar,Miyazaki Sabou Tea Garden, 0 ,From JPY ¥600,Available,https://yunomi.life//collections/green-tea/products/okumidori-kamairicha-green-tea-from-miyazaki-single-cultivar
263,Furuichi Seicha: #14 Karigane Kukicha with Uji Matcha 宇治抹茶入り雁金 (100g),Furuichi Seicha, 2 ,"From JPY ¥1,280",Available,https://yunomi.life//collections/green-tea/products/furuichi-seicha-karigane-kukicha-with-matcha-100-g
264,"Tarui Tea Farm: Organic Genmaicha, Autumn Harvest, Single Cultivar Shizu 7132",Tarui Tea Farm, 1 ,From JPY ¥400,Available,https://yunomi.life//collections/green-tea/products/tarui-tea-farm-organic-genmaicha
265,Miyazaki Sabou MY05: Kamairicha Green Tea - Takachiho Single Cultivar,Miyazaki Sabou Tea Garden, 1 ,From JPY ¥600,Available,https://yunomi.life//collections/green-tea/products/takachiho-kamairicha-green-tea-from-miyazaki-single-cultivar
266,Yokota Tea Garden: Sayamacha Benifuuki Sencha Green Tea,Yokota Tea Garden, 1 ,From JPY ¥999,Only 1 unit left,https://yunomi.life//collections/green-tea/products/yokota-09-benifuuki-sencha-green-tea
267,"Shogyokuen: Kabusecha, Tsuki no Hikari　祥玉園　月の光",Shogyokuen Tea Factory, 2 ,From JPY ¥600,Available,https://yunomi.life//collections/green-tea/products/shogyokuen-standard-gyokuro-tsuki-no-hikari
268,Morihan: Uji Matcha Frozen Ice Cream Dessert Mix,Yunomi Pantry, 0 ,From JPY ¥680,Available,https://yunomi.life//collections/green-tea/products/uji-matcha-frozen-dessert-mix
269,Miyano Tea Factory: Sayama Premium Genmaicha with Matcha 特上抹茶入り玄米茶,Miyano Tea Factory, 2 ,From JPY ¥500,Only 3 units left,https://yunomi.life//collections/green-tea/products/miyano-tea-factory-sayama-premium-genmaicha-with-matcha
270,Miyano Tea Factory: 2020 Imperial Sayama Fukamushi Sencha Komachi 狭山小町,Miyano Tea Factory, 0 ,"From JPY ¥1,000",Available,https://yunomi.life//collections/green-tea/products/miyano-tea-factory-imperial-sayama-fukamushi-sencha-komachi
271,Okumura Seikan: Tin Presentation Lids for Storage Cannisters (40g / 175g sizes),Okumura Seikan, 0 ,From JPY ¥200,"In stock, 86 units",https://yunomi.life//collections/green-tea/products/okumura-seikan-tin-presentation-lids-for-storage-cannisters-40g-175g-sizes
272,"Obubu: Sencha of the Wind, Shaded Spring Green Tea",Kyoto Obubu Tea Farms, 7 ,From JPY ¥600,Available,https://yunomi.life//collections/green-tea/products/obubu-03-sencha-of-the-wind-shaded-spring-green-tea
273,Kaneroku Matsumoto Tea Garden: Yakushima Cedar Wood Smoked Hojicha 燻製焙茶 屋久杉,Kaneroku Matsumoto Tea Garden, 3 ,From JPY ¥700,Available,https://yunomi.life//collections/green-tea/products/kaneroku-matsumoto-tea-garden-smoked-hojicha
274,NaturaliTea #09: Superior Hojicha Roasted Green Tea (Spring Harvest) 上ほうじ茶,NaturaliTea, 6 ,From JPY ¥500,"In stock, 11 units",https://yunomi.life//collections/green-tea/products/naturalitea-09-superior-hojicha-roasted-green-tea
275,"Nishide: Uji Matcha Chiyo Mukashi 千代昔 宇治抹茶, Stone mill ground, Standard Ceremonial Grade 40g",Nishide Tea Factory, 3 ,"JPY ¥2,300",Available,https://yunomi.life//collections/green-tea/products/nishide-uji-matcha-chiyo-mukashi
276,NaturaliTea #23: Fujieda Matcha Basic Ceremonial Grade 藤枝有機抹茶 (50g),NaturaliTea, 1 ,"JPY ¥1,499",Available,https://yunomi.life//collections/green-tea/products/naturalitea-23-fujieda-matcha
277,Dokodemosora #02: Naturally Grown Wakayama Superior Hojicha Roasted Green Tea,Dokodemosora Tea Farm, 6 ,From JPY ¥500,Available,https://yunomi.life//collections/green-tea/products/dokodemosora-02-naturally-grown-wakayama-superior-hojicha
278,Yokota Tea Garden #01: Kuki (Stems) Hojicha,Yokota Tea Garden, 6 ,From JPY ¥480,Available,https://yunomi.life//collections/green-tea/products/yokota-03-kuki-stems-houjicha
279,"Murakami Tea Garden: Superior Mountain-Grown Yabukita Sencha from Yoshiwara, Shizuoka 上煎茶",Murakami Tea Garden, 2 ,From JPY ¥400,Available,https://yunomi.life//collections/green-tea/products/murakami-tea-garden-superior-mountain-grown-sencha-from-yoshiwara-shizuoka
280,Yokota Tea Garden: Hatsutsumi (Hachijyuhachiya) Sayama Shincha Green Tea,Yokota Tea Garden, 0 ,From JPY ¥900,Available,https://yunomi.life//collections/green-tea/products/yokota-tea-garden-hachijyuhachiya-sayama-shincha-green-tea
281,Hachimanjyu: Organic Yakushima Hojicha Roasted Green Tea,Hachimanjyu Yakushima Tea, 2 ,From JPY ¥999,"In stock, 4 units",https://yunomi.life//collections/green-tea/products/hachimanjyu-organic-yakushima-hojicha-roasted-green-tea
282,Nagatani Tea: Uji Gyokuro - Gokou & Uji Midori (JAS Organic),Nagatani Tea, 0 ,From JPY ¥999,Available,https://yunomi.life//collections/green-tea/products/nagatani-tea-organic-uji-gyokuro-gokou-uji-midori
283,"Furuichi Seicha: #03 Oku-Chiran Sencha, Miyabi 奥知覧茶-雅",Furuichi Seicha, 1 ,From JPY ¥600,"In stock, 11 units",https://yunomi.life//collections/green-tea/products/furuichi-seicha-oku-chiran-sencha-miyabi
284,Ashikubo Teaworks: Asamushi Sencha Kunpu 足久保  薫風,Ashikubo Teaworks, 0 ,From JPY ¥580,Only 1 unit left,https://yunomi.life//collections/green-tea/products/asamushi-sencha-kunpu-by-ashikubo-teaworks
285,"Obubu #04: Sencha of the Earth, Spring Green Tea",Kyoto Obubu Tea Farms, 3 ,From JPY ¥400,Available,https://yunomi.life//collections/green-tea/products/obubu-04-sencha-of-the-earth-spring-green-tea
286,Marushige Shimizu Tea Farm: Kabusecha Green Tea Powder 粉末かぶせ,Marushige Shimizu Tea Farm, 0 ,"JPY ¥1,000",Available,https://yunomi.life//collections/green-tea/products/marushige-shimizu-kabusecha-green-tea-powder
287,Hagiri Tea Factory: Toasted Rice for Genmaicha,Hagiri Tea Factory, 1 ,"JPY ¥2,499",Available,https://yunomi.life//collections/green-tea/products/hagiri-toasted-rice-for-genmaicha
288,"#13 Dobashien Kakegawa Series: Shizuoka Aracha, Satsuki 荒茶 五月 200g",Dobashien Tea Company, 0 ,"JPY ¥1,600",Available,https://yunomi.life//collections/green-tea/products/dobashien-kakegawa-series-shizuoka-aracha-satsuki-200g
289,"Murakami Tea Garden: Limited Edition - Handpicked Mountain-Grown Kabusecha from Yoshiwara, Shizuoka",Murakami Tea Garden, 1 ,"From JPY ¥1,200","In stock, 9 units",https://yunomi.life//collections/green-tea/products/murakami-tea-garden-mountain-grown-kabusecha-from-yoshiwara-shizuoka
290,"Botebotecha from Ocha no Sankoen, Shimane, Japan",Ocha no Sankoen, 0 ,From JPY ¥450,"In stock, 5 units",https://yunomi.life//collections/green-tea/products/botebotecha-from-shimane-japan
291,Nagatani Tea: Spring Kyoto Yabukita Sencha (JAS Organic),Nagatani Tea, 0 ,From JPY ¥800,"In stock, 8 units",https://yunomi.life//collections/green-tea/products/nagatani-tea-factory-spring-sencha-grown-pesticide-free
292,Chakouan H861: Ureshino Green Tea Gyokuro Kukicha 嬉野 玉露くき茶（白折）80g,Chakouan, 1 ,From JPY ¥600,Available,https://yunomi.life//collections/green-tea/products/chakouan-11-ureshino-green-tea-gyokuro-kukicha
293,"Hachimanjyu: Organic Kamacha, Green Roasted Sencha Green Tea 屋久島茶有機緑茶  釜ちゃ",Hachimanjyu Yakushima Tea, 2 ,"JPY ¥1,200",Available,https://yunomi.life//collections/green-tea/products/hachimanjyu-organic-kamacha-green-roasted-sencha-green-tea
294,"Kurihara Tea #10: Standard Sencha, Seseragi せせらぎ",Kurihara Tea Farm, 1 ,From JPY ¥780,Available,https://yunomi.life//collections/green-tea/products/kurihara-tea-10-standard-sencha
295,"Tarui Tea Farm: Limited Reserve Aged Yabukita Kuradashi Fukamushicha, 1999 Vintage",Tarui Tea Farm, 1 ,"From JPY ¥1,100",Only 2 units left,https://yunomi.life//collections/green-tea/products/tarui-tea-farm-vintage-aged-yabukita-kuradashi-fukamushicha-1999
296,Bizenya: #03 Fukimukashi Blend - Imperial Handpicked Sayama Sencha 最高級手摘み煎茶 富貴昔,Bizenya, 0 ,"From JPY ¥1,480",Available,https://yunomi.life//collections/green-tea/products/bizenya-fukimukashi-blend-handpicked-shincha
297,"Kiroku Tea Garden: Kabusecha Aracha (unrefined tea) from Wazuka, Kyoto",Kiroku Tea Garden, 1 ,From JPY ¥800,Available,https://yunomi.life//collections/green-tea/products/kabusecha-from-kiroku-tea-garden-wazuka-kyoto
298,NaturaliTea #08: Autumn Hojicha Roasted Green Tea 無農薬茶：ほうじ茶,NaturaliTea, 3 ,From JPY ¥400,Available,https://yunomi.life//collections/green-tea/products/naturalitea-08-hojicha-roasted-green-tea
299,Takeo Tea Farm: Spring Sencha Green Tea Bags (2g x 15 bags) 緑茶ティーバッグ,Takeo Tea Farm, 1 ,JPY ¥900,Available,https://yunomi.life//collections/green-tea/products/takeo-tea-farm-spring-sencha-green-tea-bags-2g-x-15-bags
300,"Higashiyamacha: Chagusaba Sencha, Hanamori 花守 はなもり",Higashiyamacha, 0 ,"JPY ¥1,200",Only 1 unit left,https://yunomi.life//collections/green-tea/products/higashiyamacha-hanamori-chagusaba-sencha
301,Furuichi Seicha #07: Limited Edition 2021 Premium Shincha Chirancha Early First Flush Fukamushicha 特上知覧茶新茶,Furuichi Seicha, 0 ,From JPY ¥700,"In stock, 11 units",https://yunomi.life//collections/green-tea/products/furuichi-seicha-limited-edition-premium-shincha-chirancha-early-first-flush-fukamushicha
302,"Murata Tea Garden: Fukamushi Kukicha Leaf Stem Green Tea From Kikugawa, Shizuoka",Murata Tea Garden, 4 ,From JPY ¥500,Available,https://yunomi.life//collections/green-tea/products/murata-tea-garden-kukicha-leaf-stem-green-tea-from-kikugawa-shizuoka
303,Kurihara Tea #14: Oku Yame Black Tea Kurenai Yametsuhime 奥八女紅茶  紅 ∙ 八女津媛,Kurihara Tea Farm, 4 ,From JPY ¥480,Available,https://yunomi.life//collections/green-tea/products/kurihara-tea-14-oku-yame-black-tea
304,Furuichi Seicha: #16 Benifuuki Green Tea Powder 50g,Furuichi Seicha, 1 ,"JPY ¥1,700",Only 1 unit left,https://yunomi.life//collections/green-tea/products/furuichi-seicha-benifuuki-green-tea-powder-50g
305,Bizenya: #07 Shimizu Mukashi Blend - Handpicked Sayama Ichoucha Sencha 手摘み萎凋香煎茶 清水昔,Bizenya, 1 ,From JPY ¥980,Available,https://yunomi.life//collections/green-tea/products/bizenya-shimizumukashi-blend-handpicked-shincha
306,"Yamane-en: First Flush Saemidori Fukamushicha from the Yakushima Island, Kagoshima 屋久島茶",Yamane-en, 0 ,From JPY ¥500,Available,https://yunomi.life//collections/green-tea/products/yamane-en-first-flush-fukamushicha-from-the-yakushima-kagoshima-ships-late-april
307,Tarui Tea Farm: Organic Sencha Kiriyama Mushin Single Cultivar Shizu 7132　有機 霧山無心,Tarui Tea Farm, 2 ,From JPY ¥800,"In stock, 11 units",https://yunomi.life//collections/green-tea/products/tarui-family-organic-sencha-kiriyama-mushin
308,"Kiroku Tea Garden: Spring Hojicha, Single Cultivar Zairai 喜六茶園 春のほうじ茶",Kiroku Tea Garden, 0 ,From JPY ¥480,Available,https://yunomi.life//collections/green-tea/products/hojicha-from-kiroku-tea-garden-wazuka-kyoto
309,Chiyonoen Tea Garden: #12 Mountain-Grown Sencha Green Tea Sakurabana 煎茶「桜花」,Chiyonoen Tea Garden, 1 ,From JPY ¥499,Available,https://yunomi.life//collections/green-tea/products/chiyonoen-tea-garden-mountain-grown-sencha-green-tea-sakurabana
310,"Nakai Tea Farm: Yabukita Fukamushicha from Wazuka, Kyoto. Grown Without Pesticides",Nakai Tea Farm, 1 ,From JPY ¥700,"In stock, 19 units",https://yunomi.life//collections/green-tea/products/nakai-tea-farm-2019-fukamushicha-from-wazuka-kyoto-grown-without-pesticides
311,Miyano Tea Factory: Sayama Light Roasted Spring Leaf Stems (Kuki Hojicha) 香りの特上浅炒りほうじ茶,Miyano Tea Factory, 0 ,From JPY ¥500,Available,https://yunomi.life//collections/green-tea/products/miyano-tea-factory-sayama-light-roasted-leaf-stems-kuki-hojicha
312,"Chakouan H841: Ureshino Green Tea, Ochatama 嬉野玉茶、お茶たま",Chakouan, 11 ,From JPY ¥500,Available,https://yunomi.life//collections/green-tea/products/chakouan-14-ureshino-green-tea-gyokucha-ochatama
313,Miyazaki Sabou MY02: Kamairicha Green Tea - Minekaori Single Cultivar,Miyazaki Sabou Tea Garden, 1 ,From JPY ¥600,Available,https://yunomi.life//collections/green-tea/products/minekaori-kamairicha-green-tea-from-miyazaki-single-cultivar
314,"Shogyokuen: Gyokushin Mecha, Kousui 光翠",Shogyokuen Tea Factory, 1 ,From JPY ¥800,Available,https://yunomi.life//collections/green-tea/products/shogyokuen-gyokuro-kousui
315,Bizenya: #06 Kasumino - Sayama Ichoucha Sencha,Bizenya, 1 ,From JPY ¥750,Available,https://yunomi.life//collections/green-tea/products/bizenya-kasumino-sayama-ichoucha-sencha
316,"Chiyonoen Tea Garden: #02 Mountain-Grown Single Cultivar Sencha, Okumidori おくみどり",Chiyonoen Tea Garden, 2 ,From JPY ¥700,Available,https://yunomi.life//collections/green-tea/products/chiyonoen-tea-garden-mountain-grown-single-cultivar-sencha-okumidori
317,Yoshino Tea Garden: Fukumidori Single Cultivar Sayama Sencha Green Tea,Yoshino Tea Garden, 1 ,"JPY ¥3,000",Available,https://yunomi.life//collections/green-tea/products/yoshino-tea-garden-fukumidori-single-cultivar-sencha-sayama-saitama
318,Yoshino Tea Garden: Komakage Single Cultivar Sayama Sencha Green Tea,Yoshino Tea Garden, 1 ,"JPY ¥2,000",Available,https://yunomi.life//collections/green-tea/products/yoshino-tea-garden-komakage-single-cultivar-sencha-sayama-saitama
319,Yoshino Tea Garden: Hokumei Single Cultivar Sayama Sencha Green Tea,Yoshino Tea Garden, 1 ,"JPY ¥2,000",Available,https://yunomi.life//collections/green-tea/products/yoshino-tea-garden-hokumei-single-cultivar-sencha-sayama-saitama
320,Yoshino Tea Garden: Yume Wakaba Single Cultivar Sayama Sencha Green Tea,Yoshino Tea Garden, 2 ,"JPY ¥2,000",Only 3 units left,https://yunomi.life//collections/green-tea/products/yoshino-tea-garden-yume-wakaba-single-cultivar-sencha-sayama-saitama
321,Yoshino Tea Garden: Sayama Kaori Single Cultivar Sayama Sencha Green Tea,Yoshino Tea Garden, 2 ,From JPY ¥600,Available,https://yunomi.life//collections/green-tea/products/yoshino-tea-garden-sayama-kaori-single-cultivar-sencha-sayama-saitama
322,Oguri Tea Farms: Pineapple Flavored Shizuoka Hojicha (Roasted Green Tea),Oguri Tea Farms, 0 ,From JPY ¥500,Available,https://yunomi.life//collections/green-tea/products/oguri-tea-farms-pineapple-flavored-shizuoka-hojicha
323,Oguri Tea Farms: Caramel Flavored Shizuoka Hojicha,Oguri Tea Farms, 0 ,From JPY ¥500,Available,https://yunomi.life//collections/green-tea/products/oguri-tea-farms-caramel-flavored-shizuoka-hojicha
324,#17 Dobashien Kakegawa Series: Imperial Shizuoka Hojicha Roasted Green Tea Leaf Stems 極上ほうじ茶,Dobashien Tea Company, 0 ,From JPY ¥400,Available,https://yunomi.life//collections/green-tea/products/dobashien-kakegawa-series-imperial-shizuoka-hojicha-roasted-green-tea-leaf-stems
325,"Marushige Shimizu Tea Farm: Kabusecha Shaded Green Tea, Saeakari さえあかり",Marushige Shimizu Tea Farm, 1 ,JPY ¥480,Available,https://yunomi.life//collections/green-tea/products/marushige-shimizu-kabusecha-shaded-green-tea-saeakari
326,Sakura Bark Tea Canister (Chazutsu) with Paulownia Wood Box,Yunomi Lifestyle, 0 ,"JPY ¥18,000",Available,https://yunomi.life//collections/green-tea/products/sakura-bark-tea-canister-chazutsu-with-paulownia-wood-box
327,Juroen: Baking Matcha Powder,Yunomi Pantry, 0 ,From JPY ¥700,Available,https://yunomi.life//collections/green-tea/products/juroen-baking-matcha-powder
328,Obubu Tea: Roasted Autumn Tencha Stems - Tsugumi (80g),Kyoto Obubu Tea Farms, 0 ,"JPY ¥1,000",Available,https://yunomi.life//collections/green-tea/products/obubu-tea-roasted-autumn-tencha-stems-tsugumi-80g
329,"Seiwa 10848: Matcha Bags, Aluminum Foil Gusset-style (130 mm length, 20g matcha)",Seiwa Packaging, 0 ,From JPY ¥220,Available,https://yunomi.life//collections/green-tea/products/seiwa-matcha-bags-aluminum-foil-gusset-style-130-mm-length
