,tea_name,tea_origin,tea_star,tea_price,tea_availability,tea_link
442,"Chakouan H858: Ureshino Green Tea Select, Mai 嬉野 美撰　舞",Chakouan, 0 ,From JPY ¥600,Available,https://yunomi.life//collections/green-tea/products/chakouan-07-ureshino-green-tea-select-mai
443,Yamane-en: Uji Matcha Jurei 40g Can,Yamane-en, 0 ,"From JPY ¥2,500",Available,https://yunomi.life//collections/green-tea/products/yamane-en-uji-matcha-jurei-40g-can
444,"Seikoen Tea Factory: Aged Yukimuro Sencha, 1 case (80g x 12)",Seikoen, 0 ,"JPY ¥33,600",Available,https://yunomi.life//collections/green-tea/products/seikoen-tea-factory-aged-yukimuro-sencha-1-case-80g-x-12
445,"JA Kochi: Tosa Green tea, Gold label",JA Kochi, 0 ,From JPY ¥800,Available,https://yunomi.life//collections/green-tea/products/ja-kochi-tosa-green-tea-gold-label
446,"Morita Tea Shop: Asakiri, Premium Hojicha (100g)",Morita Tea Shop, 0 ,"JPY ¥1,200","In stock, 5 units",https://yunomi.life//collections/green-tea/products/morita-tea-shop-asakiri-premium-hojicha
447,"Nakamura-en #03: Kabuse Karigane, Premium shaded leaf stems",Nakamura-en, 3 ,From JPY ¥450,"In stock, 13 units",https://yunomi.life//collections/green-tea/products/nakamura-en-03-kabuse-karigane-premium-shaded-leaf-stems
448,Chakouan H1010: Chiran Green Tea Fukamushi Premium 特上煎茶,Chakouan, 0 ,From JPY ¥600,"In stock, 5 units",https://yunomi.life//collections/green-tea/products/chakouan-09-chiran-green-tea-fukamushi-premium
449,"JA Kochi: Tosa green tea, Silver label",JA Kochi, 0 ,From JPY ¥700,Available,https://yunomi.life//collections/green-tea/products/ja-kochi-tosa-green-tea-silver-label
450,"Seiwa 11764: Matcha Bags, Aluminum Foil Gusset-style (200 mm length, 60g matcha)",Seiwa Packaging, 0 ,From JPY ¥300,Available,https://yunomi.life//collections/green-tea/products/seiwa-matcha-bags-aluminum-foil-gusset-style-200-mm-length-60g-matcha
451,"#22 Dobashien: Kochi Sencha, Tosa no Kaori 100g 土佐の香",Dobashien Tea Company, 0 ,"JPY ¥1,600",Available,https://yunomi.life//collections/green-tea/products/dobashien-kochi-sencha-tosa-no-kaori
452,"#05 Dobashien Kakegawa Series: Shizuoka Sencha, Hatsuzumi 初摘",Dobashien Tea Company, 1 ,From JPY ¥500,Available,https://yunomi.life//collections/green-tea/products/dobashien-kakegawa-series-shizuoka-sencha-hatsuzumi
453,"Higashiyamacha: Chagusaba Sencha, Hanameguri 花巡 はなめぐり",Higashiyamacha, 0 ,"JPY ¥2,000",Only 3 units left,https://yunomi.life//collections/green-tea/products/higashiyamacha-hanameguri-chagusaba-sencha
454,"Seiwa 21013: Washi paper bag, flat 110 x 230, Autumn Persimmon with 秋茶ものがたり",Seiwa Packaging, 0 ,From JPY ¥800,Available,https://yunomi.life//collections/green-tea/products/seiwa-21013-washi-paper-bag-flat-110-x-230-autumn-persimmon-with
455,"Chakouan H856: Ureshino Green Tea Sencha Select, Kiwami",Chakouan, 0 ,"From JPY ¥1,200",Available,https://yunomi.life//collections/green-tea/products/chakouan-05-ureshino-green-tea-sencha-select-kiwami
456,Kuma Tea Garden: Heritage Grade Yame Matcha Saemidori (20g),Kuma Tea Gardens, 0 ,"JPY ¥3,999",Only 2 units left,https://yunomi.life//collections/green-tea/products/kuma-tea-gardens-matcha-saemidori
457,JA Kochi: Tosa Black Tea,JA Kochi, 0 ,"JPY ¥1,299",Available,https://yunomi.life//collections/green-tea/products/ja-kochi-tosa-black-tea
458,"Cultivar Comparison: Marushige Shimizu Tea Farm - Saeakari, Saemidori, Terakawa-wase, Tsuyuhikari",Marushige Shimizu Tea Farm, 0 ,"JPY ¥2,499",Available,https://yunomi.life//collections/green-tea/products/cultivar-comparison-marushige-shimizu-tea-farm-saeakari-saemidori-tsuyuhikari
459,"Saikai Ceramics: Chopstick Stand, White Glazed, Hasamiyaki Porcelain",Saikai Ceramics, 0 ,"JPY ¥2,200",Available,https://yunomi.life//collections/green-tea/products/saikai-ceramics-chopstick-stand-white-glazed-hasamiyaki-porcelain
460,"JA Kochi: Tosa Aburicha, Leaf",JA Kochi, 0 ,"JPY ¥2,100",Available,https://yunomi.life//collections/green-tea/products/ja-kochi-tosa-aburicha-leaf
461,"#21 Dobashien: Gifu Sencha, Shirakawa no Kaori 白川の香",Dobashien Tea Company, 0 ,"JPY ¥1,500",Available,https://yunomi.life//collections/green-tea/products/dobashien-gifu-sencha-shirakawa-no-kaori
462,"Chiyonoen Tea Garden: #04 Mountain-Grown Single Cultivar Sencha, Yama no Ibuki 山の息吹",Chiyonoen Tea Garden, 0 ,From JPY ¥680,"In stock, 14 units",https://yunomi.life//collections/green-tea/products/chiyonoen-tea-garden-mountain-grown-single-cultivar-sencha-yama-no-ibuki
463,"#03 Dobashien Kakegawa Series: Premium Shizuoka Sencha, Iwashimizu 岩清水",Dobashien Tea Company, 0 ,From JPY ¥850,"In stock, 5 units",https://yunomi.life//collections/green-tea/products/dobashien-kakegawa-series-premium-shizuoka-sencha-iwashimizu
464,"Kuma Tea Garden: Yame Oboro Matcha, Single Estate (Okumidori)",Kuma Tea Gardens, 0 ,"JPY ¥2,900",Available,https://yunomi.life//collections/green-tea/products/kuma-tea-gardens-okumidori-matcha
465,Kuma Tea Garden: Yamecha Mountain-Grown Fukamushicha Yabukita & Okuyutaka Blend,Kuma Tea Gardens, 1 ,From JPY ¥600,Available,https://yunomi.life//collections/green-tea/products/kuma-tea-gardens-mountain-grown-fukamushicha-yabukita-okuyutaka-blend
466,Hagiri Tea Factory: Organic Shizuoka Genmaicha w/matcha 150g,Hagiri Tea Factory, 0 ,"JPY ¥1,300",Available,https://yunomi.life//collections/green-tea/products/hagiri-tea-factory-organic-shizuoka-genmaicha-w-matcha-150g
467,Kuma Tea Garden: Yamecha Mountain-Grown Sencha Yabukita 奥八女 上陽茶 やぶきた,Kuma Tea Gardens, 0 ,From JPY ¥700,Available,https://yunomi.life//collections/green-tea/products/kuma-tea-gardens-mountain-grown-hachijyuhachiya-sencha-yabukita
468,Kuma Tea Garden: Yamecha Mountain-Grown Sencha Okuyutaka おくやぶきた,Kuma Tea Gardens, 2 ,From JPY ¥800,Available,https://yunomi.life//collections/green-tea/products/kuma-tea-gardens-mountain-grown-sencha-okuyutaka-blend
469,"Ocharaka: Mocha Hojicha, flavored roasted green tea",Ocharaka Tea Shop, 0 ,From JPY ¥800,"In stock, 4 units",https://yunomi.life//collections/green-tea/products/ocharaka-mocha-hojicha-flavored-roasted-green-tea
470,"Shogyokuen: Toyomukashi, Premium Ceremonial Grade Matcha (40g can, Spring Harvest) 豊昔",Shogyokuen Tea Factory, 0 ,"From JPY ¥2,999",Available,https://yunomi.life//collections/green-tea/products/shogyokuen-matcha-toyomukashi-premium-ceremonial-grade
471,Tarui Tea Farm: Organic Artisanal Shizuoka Spring Sencha Green Tea Bags,Tarui Tea Farm, 0 ,From JPY ¥495,"In stock, 12 units",https://yunomi.life//collections/green-tea/products/tarui-tea-farm-artisanal-sencha-green-tea-bags
472,"#29 Dobashien: Shizuoka Sencha from Kawane, Kawane no Homare 川根の誉",Dobashien Tea Company, 0 ,"JPY ¥2,300",Available,https://yunomi.life//collections/green-tea/products/dobashien-shizuoka-sencha-from-kawane-kawane-no-homare
473,"#20 Dobashien: Fukuoka Sencha, Yame no Kaori 100g 八女の香",Dobashien Tea Company, 0 ,"JPY ¥1,600",Available,https://yunomi.life//collections/green-tea/products/dobashien-fukuoka-sencha-yame-no-kaori
474,"#19 Dobashien: Fukuoka Sencha, Yame no Homare 100g 八女の誉",Dobashien Tea Company, 0 ,"JPY ¥2,480",Available,https://yunomi.life//collections/green-tea/products/dobashien-fukuoka-sencha-yame-no-homare
475,"#30 Dobashien: Ureshino Shincha from Saga, Ureshino no Kaori 嬉野の香",Dobashien Tea Company, 0 ,"JPY ¥1,500",Available,https://yunomi.life//collections/green-tea/products/dobashien-ureshino-shincha-from-saga-ureshino-no-kaori
476,"#26 Dobashien: Satsuma Sencha from Chiran, Kagoshima 薩摩 知覧茶",Dobashien Tea Company, 0 ,"JPY ¥1,600",Available,https://yunomi.life//collections/green-tea/products/dobashien-satsuma-sencha-from-chiran-kagoshima
477,"#07 Dobashien Kakegawa Series: Shizuoka Sencha, Oimatsu 老松",Dobashien Tea Company, 0 ,"JPY ¥1,500",Available,https://yunomi.life//collections/green-tea/products/dobashien-kakegawa-series-shizuoka-sencha-oimatsu
478,"#06 Dobashien Kakegawa Series: Shizuoka Sencha, Hououzan 鳳凰山",Dobashien Tea Company, 0 ,"JPY ¥1,200",Available,https://yunomi.life//collections/green-tea/products/dobashien-kakegawa-series-shizuoka-sencha-hououzan
479,"#04 Dobashien Kakegawa Series: Shizuoka Sencha, Akari あかり",Dobashien Tea Company, 0 ,"JPY ¥2,100",Available,https://yunomi.life//collections/green-tea/products/dobashien-kakegawa-series-shizuoka-sencha-akari
480,"#12 Dobashien Kakegawa Series: Spring Harvested Shizuoka Aracha, Hatsumidori 荒茶 初緑 200g",Dobashien Tea Company, 0 ,From JPY ¥500,"In stock, 9 units",https://yunomi.life//collections/green-tea/products/dobashien-kakegawa-series-shizuoka-aracha-hatsumidori-200g
481,#16 Dobashien Kakegawa Series: Superior Spring Shizuoka Fukamushicha Genmaicha 上玄米茶,Dobashien Tea Company, 0 ,JPY ¥800,Available,https://yunomi.life//collections/green-tea/products/dobashien-kakegawa-series-shizuoka-genmaicha
482,"#14 Dobashien Kakegawa Series: Shizuoka Karigane, Leaf Stems Green Tea 100g 特上かりがね",Dobashien Tea Company, 0 ,"JPY ¥1,200",Available,https://yunomi.life//collections/green-tea/products/dobashien-kakegawa-series-shizuoka-karigane-leaf-stems-green-tea-100g
483,Tarui Tea Farm: Organic Genmaicha Powder 有機粉末玄米茶,Tarui Tea Farm, 0 ,From JPY ¥899,Available,https://yunomi.life//collections/green-tea/products/tarui-tea-farm-organic-genmaicha-powder
484,Tarui Tea Farm: Organic Hojicha Powder 粉末ほうじ茶,Tarui Tea Farm, 0 ,From JPY ¥899,Available,https://yunomi.life//collections/green-tea/products/tarui-tea-farm-organic-hojicha-powder
485,"Chiyonoen Tea Garden: #10 Mountain-Grown Yame Sencha, Yabukita 1955",Chiyonoen Tea Garden, 2 ,"From JPY ¥1,200",Available,https://yunomi.life//collections/green-tea/products/chiyonoen-tea-garden-mountain-grown-yame-sencha-yabukita-1955
486,"Morita Tea Shop: Wakaba no Kaori, Kukicha Stem Tea (200g)",Morita Tea Shop, 1 ,"JPY ¥1,989",Only 3 units left,https://yunomi.life//collections/green-tea/products/morita-tea-shop-wakaba-no-kaori-kukicha-stem-tea
487,"Uejima Tea Farm: Gyokuro Gokou from Wazuka Village, Kyoto 宇治和束茶玉露",Uejima Tea Farm, 2 ,"JPY ¥2,499","In stock, 8 units",https://yunomi.life//collections/green-tea/products/uejima-tea-farm-gyokuro-from-wazuka-village-kyoto
488,Uejima Tea Farm: Wazuka Sencha Premium (Okumidori/Tsuyuhikari) 特上煎茶,Uejima Tea Farm, 0 ,From JPY ¥800,"In stock, 8 units",https://yunomi.life//collections/green-tea/products/uejima-tea-farm-wazuka-sencha-premium
489,Uejima Tea Farm: Karigane - Gyokuro Leaf Stems 玉露かりがね,Uejima Tea Farm, 1 ,From JPY ¥800,"In stock, 10 units",https://yunomi.life//collections/green-tea/products/uejima-tea-farm-karigane-gyokuro-leaf-stems
490,"Uejima Tea Farm: Wazuka Sannen Bancha, 3-year aged roasted bancha tea 京都宇治和束茶 三年番茶",Uejima Tea Farm, 0 ,"JPY ¥1,500","In stock, 9 units",https://yunomi.life//collections/green-tea/products/uejima-tea-farm-wazuka-sannen-bancha-3-year-aged-bancha
491,Yunomi Discoveries: 2021 Spring First Flush Green Tea Sampler,Yunomi Tea, 12 ,"JPY ¥2,999",Available,https://yunomi.life//collections/green-tea/products/first-flush-green-tea-sampler
492,"Ayumi Farms (Cyittorattu): Handpicked Shizuoka Sencha (Ultra Micro Lot, Limited Edition)  手と手で紡ぐ「手摘み煎茶」 30g",Ayumi Farms, 0 ,"JPY ¥2,499","In stock, 5 units",https://yunomi.life//collections/green-tea/products/ayumi-farms-cyittorattu-handpicked-shizuoka-sencha-ultra-micro-lot-30g
493,"Yamane-en: Spring Saemidori Fukamushicha Green Tea, Chirancha from Kagoshima 特選　知覧さえみどり",Yamane-en, 2 ,From JPY ¥950,Available,https://yunomi.life//collections/green-tea/products/yamane-en-spring-saemidori-fukamushicha-green-tea-chirancha-from-kagoshima
494,Nishide: Uji Shincha Premium 特上宇治新茶,Nishide Tea Factory, 0 ,From JPY ¥800,"In stock, 6 units",https://yunomi.life//collections/green-tea/products/nishide-shincha-premium
495,"Matcha Tea Can, Black Screw Top",Okumura Seikan, 0 ,JPY ¥400,"In stock, 97 units",https://yunomi.life//collections/green-tea/products/matcha-tea-can-black-screw-top
496,"Matcha Tea Can, Silver Screw Top",Okumura Seikan, 1 ,JPY ¥400,"In stock, 25 units",https://yunomi.life//collections/green-tea/products/okumura-seikan-matcha-tea-can-silver-screw-top
497,"Matcha Tea Can, Gold Screw Top",Okumura Seikan, 0 ,JPY ¥400,"In stock, 25 units",https://yunomi.life//collections/green-tea/products/okumura-seikan-matcha-tea-can-gold-screw-top
498,Obubu: Hoji-Genmaicha Using Kyoto Bancha,Kyoto Obubu Tea Farms, 0 ,"JPY ¥1,500",Available,https://yunomi.life//collections/green-tea/products/obubu-hoji-genmaicha-using-kyoto-bancha
499,"Hachimanjyu: Organic Aracha, Farmer's Green Tea (Unrefined) 屋久島あら茶",Hachimanjyu Yakushima Tea, 6 ,JPY ¥999,"In stock, 8 units",https://yunomi.life//collections/green-tea/products/hachimanjyu-organic-aracha-farmers-green-tea-unrefined
500,"JA Kagoshima Chagyo: Chirancha Fukamushicha, Silver Label 知覧茶  銀印",JA Kagoshima Chagyo, 2 ,From JPY ¥500,Only 3 units left,https://yunomi.life//collections/green-tea/products/ja-kagoshima-chagyo-chirancha-sencha-silver-label
501,JA Kagoshima Chagyo: Keiten - Premium Sencha,JA Kagoshima Chagyo, 0 ,From JPY ¥900,"In stock, 4 units",https://yunomi.life//collections/green-tea/products/ja-kagoshima-chagyo-keiten
502,Nishide Premium Selection: Handpicked Gyokuro Gokou by The Shimooka Tea Farm 宇治田原下岡茶園製玉露手摘ごこう,Nishide Tea Factory, 2 ,From JPY ¥800,Available,https://yunomi.life//collections/green-tea/products/nishide-premium-selection-handpicked-gyokuro-gokou-by-the-shitaoka-tea-farm
503,"Mandara Green Tea Sampler Set by Kadode Ooigawa, Shizuoka - 4 steaming levels vs 4 green-roasting levels. (16 tea bags)",Yunomi Tea, 0 ,"JPY ¥7,980","In stock, 11 units",https://yunomi.life//collections/green-tea/products/mandara-green-tea-by-kadode-ooigawa
504,Yamane-en: Select Ureshino First Flush Guricha,Yamane-en, 0 ,From JPY ¥800,Available,https://yunomi.life//collections/green-tea/products/yamane-en-ureshino-first-flush-guricha
505,Yamane-en: Standard Ureshino First Flush Guricha,Yamane-en, 0 ,From JPY ¥620,Available,https://yunomi.life//collections/green-tea/products/yamane-en-ureshino-first-flush-guricha-standard
506,Shogyokuen: Tencha Green Tea Leaves Yabukita Single Cultivar,Shogyokuen Tea Factory, 0 ,From JPY ¥480,Available,None
507,Shogyokuen: Tencha Green Tea Leaves Okumidori Single Cultivar,Shogyokuen Tea Factory, 0 ,From JPY ¥580,Available,None
508,Shogyokuen: Tencha Green Tea Leaves Basic,Shogyokuen Tea Factory, 0 ,JPY ¥680,Available,None
509,Shogyokuen: Tencha Green Tea Leaves Single Cultivar,Shogyokuen Tea Factory, 0 ,From JPY ¥680,Available,None
510,Nakai Tea Farm: Premium Yabukita Sencha from Wazuka Kyoto. Grown Without Pesticides,Nakai Tea Farm, 1 ,From JPY ¥700,Available,https://yunomi.life//collections/green-tea/products/nakai-tea-farm-kyoto-sencha
511,Yokota Tea Garden: Benifuuki Green Tea Powder Single Servings 14 pcs,Yokota Tea Garden, 0 ,"JPY ¥1,299",Sold out,https://yunomi.life//collections/green-tea/products/yokota-11-benifuuki-green-tea-powder-single-servings-14-pcs
512,"Chiyonoen Tea Garden: #06 Mountain-Grown Single Cultivar Sencha, Okuyutaka 品種別茶「おくゆたか」",Chiyonoen Tea Garden, 2 ,From JPY ¥600,Sold out,https://yunomi.life//collections/green-tea/products/chiyonoen-tea-garden-mountain-grown-single-cultivar-sencha-okuyutaka
513,"Furyu: Hi no Nagare - The Flow of Fire. Spring Kumamoto Kamairicha, Limited 2020",Furyu Bancha Specialty Shop, 1 ,From JPY ¥800,Sold out,https://yunomi.life//collections/green-tea/products/furyu-hi-no-nagare-the-flow-of-fire-spring-kumamoto-kamairicha-limited-2019
514,Nakamura-en #06: 2020 First Flush Superior Shizuoka Sencha,Nakamura-en, 0 ,From JPY ¥500,Sold out,https://yunomi.life//collections/green-tea/products/nakamura-en-06-2020-first-flush-superior-shizuoka-sencha
515,Nakamura-en #05: 2020 First Flush Premium Shizuoka Sencha,Nakamura-en, 0 ,From JPY ¥700,Sold out,https://yunomi.life//collections/green-tea/products/nakamura-en-05-shincha-2019-first-flush-sencha
516,"JA Kochi: Tosa green tea, Green label",JA Kochi, 0 ,From JPY ¥400,Sold out,https://yunomi.life//collections/green-tea/products/ja-kochi-tosa-green-tea-green-label
517,Sawa Houzan: Shigaraki-yaki Shiboridashi Yokode Kyusu Teapot for Two,Sawa Houzan, 2 ,"JPY ¥6,999",Sold out,https://yunomi.life//collections/green-tea/products/sawa-houzan-shigaraki-yaki-shiboridashi-yokode-kyusu-teapot-for-two
518,Nishide: Superior Uji Gyokuro Gokoma,Nishide Tea Factory, 3 ,From JPY ¥700,Sold out,https://yunomi.life//collections/green-tea/products/nishide-superior-uji-gyokuro-gokoma
519,Kaneroku Matsumoto Tea Garden: Shincha - Limited Edition - Ohashiri 大走り新茶2021,Kaneroku Matsumoto Tea Garden, 0 ,From JPY ¥800,Sold out,https://yunomi.life//collections/green-tea/products/kaneroku-matsumoto-tea-garden-shincha-limited-edition-ohashiri
520,Kaneroku Matsumoto Tea Garden: Shincha - Limited Edition 新茶2021,Kaneroku Matsumoto Tea Garden, 0 ,From JPY ¥600,Sold out,https://yunomi.life//collections/green-tea/products/kaneroku-matsumoto-tea-garden-shincha-limited-edition-2021-pre-order-ships-in-may
521,"Okumura Seikan 774M: Matcha Tea Can, Chiyogami Washi Paper - Sakura Red (size for 40g)",Okumura Seikan, 0 ,JPY ¥600,Sold out,https://yunomi.life//collections/green-tea/products/okumura-seikan-matcha-tea-can-chiyogami-washi-paper-sakura-red
522,"Furyu: Batabatacha, Rare Bancha Tea ふりゅう バタバタ茶",Furyu Bancha Specialty Shop, 12 ,JPY ¥999,Sold out,https://yunomi.life//collections/green-tea/products/furyu-batabatacha-rare-bancha-tea-30g
523,Uejima Tea Farm: Five Cultivar Sencha Green Tea Tasting Set (10g each) 5種の品種別お試しセット,Uejima Tea Farm, 0 ,"JPY ¥1,999",Sold out,https://yunomi.life//collections/green-tea/products/uejima-tea-farm-five-cultivar-green-tea-tasting-set
524,Ocharaka: Hojicha Japanese Pumpkin flavored roasted green tea,Ocharaka Tea Shop, 2 ,"From JPY ¥1,000",Sold out,https://yunomi.life//collections/green-tea/products/ocharaka-hojicha-japanese-pumpkin-flavored-roasted-green-tea
525,Chasandai Tea Factory: Shimane-Grown Roasted Bancha (Unrolled Hojicha) 100g,Chasandai Tea Factory, 0 ,"JPY ¥1,299",Sold out,https://yunomi.life//collections/green-tea/products/chasandai-shimane-grown-organic-bancha-green-tea
526,"Yunomi Discoveries: Mystery Green Tea, 100 grams",Yunomi Tea, 48 ,From JPY ¥800,Sold out,https://yunomi.life//collections/green-tea/products/green-tea-100g
527,"Kogane Midori Golden Sencha, Single Cultivar",Kogane Midori Tea Garden, 3 ,"From JPY ¥1,299",Sold out,https://yunomi.life//collections/green-tea/products/kogane-midori-golden-sencha
528,Yunomi Tea House Blend: Genmaicha Brown Rice Green Tea,Yunomi Tea, 2 ,From JPY ¥250,Sold out,https://yunomi.life//collections/green-tea/products/yunomi-tea-house-blend-genmaicha-brown-rice-green-tea
529,Seikoen Tea Factory No. 30: Saemidori Fukamushicha (Kagoshima) - Connoisseur’s Choice,Seikoen, 0 ,From JPY ¥999,Sold out,https://yunomi.life//collections/green-tea/products/seikoen-tea-factory-saemidori-fukamushicha-kagoshima-connoisseur-s-choice-ships-mid-april
530,"Marushige Shimizu Tea Farm: うぶごえ新茶 Ubugoe - Premium New Field Sencha, Saeakari (Limited edition)",Marushige Shimizu Tea Farm, 4 ,From JPY ¥500,Sold out,https://yunomi.life//collections/green-tea/products/marushige-shimizu-tea-farm-sencha-green-tea-ubugoe-new-tea-field
531,"Yunomi Green Label - Shizuoka Sencha (Early May 2020 Harvest, 2020 Shincha bag)",Yunomi Tea, 6 ,JPY ¥999,Sold out,https://yunomi.life//collections/green-tea/products/yunomi-green-label-shizuoka-sencha
532,"Matcha Bamboo Whisk (Chasen) - 64-prong, Tsuneho",Yunomi Lifestyle, 0 ,"JPY ¥2,400",Sold out,https://yunomi.life//collections/green-tea/products/matcha-bamboo-whisk-64
533,"Yamane-en: Limited Edition Fukamushi Shincha ""Sae no Takumi"", Single Cultivar Saemidori from Chiran",Yamane-en, 0 ,"From JPY ¥1,000",Sold out,https://yunomi.life//collections/green-tea/products/yamane-en-limited-edition-fukamushi-shincha-sae-no-takumi-single-cultivar-saemidori-from-chiran-ships-mid-april
534,Yunomi Dojo Lesson 106 Advanced Green Tea Tasting - Quality Spectrum Set,Yunomi Tea, 2 ,"JPY ¥4,499",Sold out,https://yunomi.life//collections/green-tea/products/yunomi-dojo-sampler-set-advanced-level-green-tea-tasting
535,Kuma Tea Garden: Yamecha Saemidori Heritage Grade Gyokuro Tenkaichi - 71st All Japan Tea Competition Grand Prize Winning Garden,Kuma Tea Gardens, 4 ,"From JPY ¥1,500",Sold out,https://yunomi.life//collections/green-tea/products/kuma-tea-gardens-saemidori-gyokuro-tenkaichi-71st-all-japan-tea-competition-grand-prize-winning-garden
536,"Nishide: Heritage Grade Uji Matcha Hatsu Mukashi, Stone mill ground 40g 宇治抹茶初昔",Nishide Tea Factory, 1 ,"JPY ¥4,130",Sold out,https://yunomi.life//collections/green-tea/products/nishide-uji-matcha-hatsu-mukashi
537,Matcha Bamboo Whisk (Chasen) - 120-prong,Yunomi Lifestyle, 2 ,"JPY ¥1,999",Sold out,https://yunomi.life//collections/green-tea/products/matcha-bamboo-whisk-120
538,Seikoen Tea Factory No. 20: Saemidori Fukamushicha (Kagoshima) - Imperial,Seikoen, 2 ,From JPY ¥799,Sold out,https://yunomi.life//collections/green-tea/products/seikoen-tea-factory-saemidori-fukamushicha-kagoshima-imperial-ships-mid-april
539,Yunomi Dojo Lesson 105: 12 Japanese Green Teas Variety Set (20g each),Yunomi Tea, 7 ,"JPY ¥4,999",Sold out,https://yunomi.life//collections/green-tea/products/japanese-green-tea-set
540,Yunomi Matcha Naturally Grown - Imperial Ceremonial Grade,Yunomi Tea, 1 ,"From JPY ¥2,999",Sold out,https://yunomi.life//collections/green-tea/products/yunomi-matcha-naturally-grown-imperial-ceremonial-grade
541,"Yamane-en: Limited Edition Fukamushi Shincha, Single Cultivar Shimamidori from the Tanegashima Island, Kagoshima",Yamane-en, 0 ,From JPY ¥500,Sold out,https://yunomi.life//collections/green-tea/products/yamane-en-limited-edition-fukamushi-shincha-single-cultivar-shimamidori-from-the-tanegashima-island-kagoshima-ships-mid-april
542,Seikoen Tea Factory No. 10: Yutaka Midori Fukamushicha (Kagoshima) - Premium,Seikoen, 0 ,From JPY ¥599,Sold out,https://yunomi.life//collections/green-tea/products/seikoen-tea-factory-yutaka-midori-fukamushicha-kagoshima-premium
543,Yokota Tea Garden: Sencha Tea Flower Blend (50g),Yokota Tea Garden, 3 ,"JPY ¥1,000",Sold out,https://yunomi.life//collections/green-tea/products/yokota-04-sencha-tea-flower-blend
544,Minoyaki Shikisai Mini Matcha Bowl,Honjien, 1 ,"JPY ¥1,999",Sold out,https://yunomi.life//collections/green-tea/products/shikisai-mini-matcha-bowl
545,"Spring 2020 Monoucha Sencha Handpicked 50g Limited, Ishinomaki Green Tea. Kashima Tea Garden & Yabe-en Tea Shop.",Yabe-en Tea Shop, 1 ,From JPY ¥800,Sold out,https://yunomi.life//collections/green-tea/products/monoucha-sencha-handpicked-50g-limited-ishinomaki-green-tea-kashima-tea-garden-yabe-en-tea-shop
546,Dokodemosora #06: Wakayama Hojicha Roasted Green Tea with Ginger & Lemongrass,Dokodemosora Tea Farm, 0 ,"JPY ¥1,999",Sold out,https://yunomi.life//collections/green-tea/products/dokodemosora-wakayama-hojicha-roasted-green-tea-with-ginger-lemongrass
547,Nakamura-en #08: Superior Genmaicha with Matcha,Nakamura-en, 0 ,From JPY ¥400,Sold out,https://yunomi.life//collections/green-tea/products/nakamura-en-superior-genmaicha-with-matcha
548,"Kikizu Tea Garden - Saemidori Cultivar Fukamushi Tamaryokucha from Sonogi, Nagasaki",Kikizu Tea Garden, 2 ,From JPY ¥750,Sold out,https://yunomi.life//collections/green-tea/products/kikizu-tea-garden-saemidori-cultivar-fukamushi-tamaryokucha-from-sonogi-nagasaki
549,"Ohashiri by Kanes Tea Factory, Premium Fukamushi Sencha, First Flush, Spring 2020",Kanes Tea Factory, 0 ,From JPY ¥500,Sold out,https://yunomi.life//collections/green-tea/products/ohashiri-by-kanes-tea-factory-premium-fukamushi-sencha-first-flush-spring-2020
550,Ocharaka: Peach Flavored Japanese Green Tea,Ocharaka Tea Shop, 0 ,From JPY ¥700,Sold out,https://yunomi.life//collections/green-tea/products/ocharaka-peach-flavored-japanese-green-tea
551,"Matcha Tea Can, Gold Patterned Screw Top",Okumura Seikan, 0 ,JPY ¥400,Sold out,https://yunomi.life//collections/green-tea/products/okumura-seikan-matcha-tea-can-gold-patterned-screw-top
552,"Kurihara Tea #19: Competition Grade Heritage Gyokuro Green Tea, 2018 Gold Medal Winner, Special AKI",Kurihara Tea Farm, 1 ,"From JPY ¥1,200",Sold out,https://yunomi.life//collections/green-tea/products/kurihara-tea-19-competition-grade-heritage-gyokuro-green-tea-2018-gold-medal-winner-special-aki
553,Marunaka: Isecha Superior Summer Aoyanagi Bancha,Marunaka Tea Factory, 1 ,From JPY ¥750,Sold out,https://yunomi.life//collections/green-tea/products/marunaka-isecha-superior-summer-aoyanagi-bancha
554,Kizoku Club: White Bizen-yaki Mini Matcha Bowl,Kizoku Club, 0 ,"JPY ¥1,500",Sold out,https://yunomi.life//collections/green-tea/products/price-kizoku-club-white-bizen-yaki-matcha-bowl
555,Ceremonial Grade Isecha Matcha - Usucha Suizawa by Hagimura Tea Factory,Hagimura Tea Factory, 1 ,"JPY ¥1,999",Sold out,https://yunomi.life//collections/green-tea/products/ceremonial-grade-isecha-matcha-usucha-suizawa-by-hagimura-tea-factory
556,"Kikizu Tea Garden - Saeakari Cultivar Fukamushi Tamaryokucha from Sonogi, Nagasaki",Kikizu Tea Garden, 1 ,From JPY ¥600,Sold out,https://yunomi.life//collections/green-tea/products/kikizu-tea-garden-saeakari-cultivar-fukamushi-tamaryokucha-from-sonogi-nagasaki
557,"(Discontinued) Furuichi Seicha: #11 Chiran Fukamushicha Sencha, Muraoka Farm 知覧茶深むし 丹精村岡",Furuichi Seicha, 4 ,From JPY ¥500,Sold out,https://yunomi.life//collections/green-tea/products/furuichi-seicha-chiran-fukamushicha-sencha-muraoka-farm
